index,subreddit,title,id,author,score,name,subscribers,comments_number,time
631,nba,Slam Ball is back- and so are injuries that make PG and Livingston’s gorelights look like child’s play,1562b5e,allthatglittersis___,80,t3_1562b5e,8009642,24,2023-07-21 22:27:24
632,nba,"[Washburn] With Jaylen Brown now back in Boston from his NBPA retreat in Spain, contract talks will resume next week, according to a league source.",155uf5p,iksnet,198,t3_155uf5p,8009642,84,2023-07-21 17:27:33
633,nba,Historic players who get overrated on r/NBA,157j1uk,AbshirThePoet,0,t3_157j1uk,8009642,108,2023-07-23 16:21:43
634,nba,Russell westbrook 2023 season How does he feel?,1575rf0,clify34,0,t3_1575rf0,8009642,7,2023-07-23 05:15:51
635,nba,Is 8 feet Giannnis the GOAT?,157h898,Carwreckking,0,t3_157h898,8009642,24,2023-07-23 15:09:01
636,nba,"[Wojnarowski] Boston Celtics G Payton Pritchard will be part of the USA Select team that will practice and scrimmage against the Team USA roster at a Las Vegas training camp in August, sources tell ESPN. Team USA is preparing for the FIBA World Cup later this summer in the Philippines.",155oxri,3rdEyeDeuteranopia,318,t3_155oxri,8009642,52,2023-07-21 14:02:36
637,nba,Reggie Miller's Legendary Playoff Scoring,155vjdf,achyutthegoat,149,t3_155vjdf,8009642,58,2023-07-21 18:09:55
638,nba,If Spider-Man was in the NBA. Would he be MJ?,157csj8,trustabro,0,t3_157csj8,8009642,21,2023-07-23 11:47:41
639,nba,One video gets deleted from a players career. Who benefits the most?,156a3pw,Scared_Difference_24,15,t3_156a3pw,8009642,80,2023-07-22 04:31:22
640,nba,"Who was a better player, Magic Johnson or Larry Bird?",155y67s,KGBeast420,92,t3_155y67s,8009642,222,2023-07-21 19:49:54
641,nba,Chicago Bulls Legend Dickey Simpkin’s Epic Double-Pump Dunk Past New York Knicks Patrick Ewing (1996),156drvq,lostacoshermanos,12,t3_156drvq,8009642,1,2023-07-22 07:51:58
642,nba,Refs out there? What's the correct call?,156tnja,mrgrumpypants63,0,t3_156tnja,8009642,5,2023-07-22 19:58:28
643,nba,"With the fate of the universe on the line, which player from your team would you want to take the shot?",1561zdn,koverage,56,t3_1561zdn,8009642,134,2023-07-21 22:14:13
644,nba,Why doesn't the WNBA drop the rim to 9 feet?,157avj4,DreamsOfJoeHill,0,t3_157avj4,8009642,39,2023-07-23 10:03:10
645,nba,Which team will have a worse record than they did last season?,155uyol,ElectronicWolf8650,110,t3_155uyol,8009642,226,2023-07-21 17:48:26
646,nba,Fox with an interesting take of the Euro step on Kuzma,155x8r0,anonahmus,83,t3_155x8r0,8009642,31,2023-07-21 19:14:48
647,nba,Aaron Baynes Baits Joel Embiid into Getting a Technical,155s90l,sstphnn,146,t3_155s90l,8009642,44,2023-07-21 16:05:48
648,nba,"TMac, Penny, Kobe dunk contest in 1997. Kobe with elbow dunk 3 years before Vince.",15659w7,xdavidliu,31,t3_15659w7,8009642,16,2023-07-22 00:35:53
649,nba,The Toronto raptors should hijack the Dame trade,15763id,nakotamcc,0,t3_15763id,8009642,46,2023-07-23 05:34:07
650,nba,Do you think 2016 Steph on the 2022 Warriors instead of current Steph win a ring?,1574v24,Roblox9GAG,0,t3_1574v24,8009642,23,2023-07-23 04:27:43
651,nba,"[Charania] New York Knicks guard Quentin Grimes will participate on the U.S. Select Team among group of rising Americans who will join Team USA camp in August for FIBA World Cup, sources tell @TheAthletic @Stadium. Grimes averaged 11.3 points as a full-time starter for Knicks last season.",155q1ke,Brady331,172,t3_155q1ke,8009642,13,2023-07-21 14:45:07
652,nba,Team of Lebron Stans vs Kobe Stans. Which team wins and is better?,156llnd,BrutallyHonesttho,1,t3_156llnd,8009642,43,2023-07-22 14:29:34
653,nba,What is your all time favorite team?,1563yll,BigDannyBoy1,29,t3_1563yll,8009642,121,2023-07-21 23:38:31
654,nba,Dwyane Wade throws the 3/4 court alley oop to Lebron James off the jump ball (2013),155xdpx,Harman3112,67,t3_155xdpx,8009642,15,2023-07-21 19:19:51
655,nba,Vince Carter baptizing Tim Duncan,155kw2z,Wild-Apricot-9161,298,t3_155kw2z,8009642,33,2023-07-21 11:09:02
656,nba,The current Clippers' situation feels underrated in its weirdness.,1564yz2,RichardAYBuck,27,t3_1564yz2,8009642,23,2023-07-22 00:22:05
657,nba,Most unguardable shot of all time,1572f08,DRob400,0,t3_1572f08,8009642,38,2023-07-23 02:20:45
658,nba,Allen Iverson says Kobe should be in the GOAT convo with Jordan and LeBron,156aph1,Mathalamon,11,t3_156aph1,8009642,96,2023-07-22 05:03:10
659,nba,"Kevin Durant on Twitter: ""I’m not that interesting for a doc, I ain’t even joking this time""",1558j5c,RiceIceRice,1751,t3_1558j5c,8009642,274,2023-07-21 00:38:01
660,nba,Who do you think has the smoothest game in the nba,156a4g8,EnvironmentalAd3385,10,t3_156a4g8,8009642,96,2023-07-22 04:32:27
661,nba,Stephen A Smith confirms he wants Shannon Sharpe on First Take,155zp6m,D09987766,42,t3_155zp6m,8009642,76,2023-07-21 20:47:22
662,nba,"Breakaway Data's 5-page biomechanical shooting lab data report sample, via ESPN. Investor Shane Battier states its mission is ""an exploration of if there is an optimal biomechanical profile to become an elite shooter"".",155qtg0,sewsgup,107,t3_155qtg0,8009642,15,2023-07-21 15:13:30
663,nba,"Michael Jordan crossover and jumpshot on Del Curry - 1998, Eastern Conference Semi-Finals, Bulls vs. Hornets, Game 2.",155nupb,ToronoRapture,150,t3_155nupb,8009642,13,2023-07-21 13:19:41
664,nba,This Will Change Your Perspective On Killian Hayes,1573t6i,dkmegg22,0,t3_1573t6i,8009642,13,2023-07-23 03:31:19
665,nba,Tim Hardaway: I think Bol Bol is better than Victor Wembanyama,1554tki,csummerss,2359,t3_1554tki,8009642,456,2023-07-20 22:05:18
666,nba,Thoughts on if Prime Tmac in the current modern NBA,1570efj,conzcious_eye,0,t3_1570efj,8009642,37,2023-07-23 00:44:26
667,nba,JiDion banned from all NBA related events for sleeping at WNBA game,154sgb8,MyMindWasAFortress,15246,t3_154sgb8,8009642,4696,2023-07-20 14:27:35
668,nba,"[Wojnarowski] New Orleans’ Trey Murphy and Minnesota’s Naz Reid will also be part of the USA Basketball Select Team for FIBA World Cup training camp in Las Vegas next month, sources tell ESPN.",155rkvg,NokCha_,85,t3_155rkvg,8009642,21,2023-07-21 15:41:41
669,nba,"[Mussatto]: OKC Mayor David Holt - ""...I can tell you today that a superstar who will play for our city in this new arena, in the next lease term, isn’t even born yet. And yet, Sam Presti is probably already holding the draft pick to get him.""",1559gkq,b4ldheed,1168,t3_1559gkq,8009642,158,2023-07-21 01:21:14
670,nba,James Harden on IG “Been comfortable for so long. It’s time to get uncomfortable.”,1553yvc,12footjumpshot,2380,t3_1553yvc,8009642,514,2023-07-20 21:32:24
671,nba,Explain to a British fan why Philly fans are the most hated fanbase across sports,156113y,ojseye,25,t3_156113y,8009642,175,2023-07-21 21:37:27
672,nba,"[Wojnarowski] Turkish G/F Onurlap Bitim has agreed on a two-way contract with the Chicago Bulls, sources tell ESPN. Bitim, 24, was a second-team EuroCup player for Bursaspor in Turkey.",155rcuv,Kimber80,76,t3_155rcuv,8009642,19,2023-07-21 15:33:15
673,nba,Who is the 2nd greatest player of the last 20 years? You can only take into account what happened between the 2002-2003 season and the 2022-2023 season.,1565xo1,VagabondReborn,12,t3_1565xo1,8009642,75,2023-07-22 01:06:59
674,nba,"[Monte Poole] ""[Draymond Green & Jonathan Kuminga's non-relationship] is a problem and it can only be fixed by Draymond. The new contract implies the Warriors believe he can fix it, but around the league there are a lot of people saying 'I don't know.'""",1554y5w,AashyLarry,1567,t3_1554y5w,8009642,620,2023-07-20 22:10:26
675,nba,Al Horford is one of the best big man defenders of this generation.,156c7rs,2016jackmaple2016,4,t3_156c7rs,8009642,22,2023-07-22 06:25:31
676,nba,Looking for clips of combo dribbling moves.,155u9jj,CoachFrikki,44,t3_155u9jj,8009642,16,2023-07-21 17:21:40
677,nba,The Ultimate in Karl Malone Slander.,1551l5w,ComradeCaveman,2184,t3_1551l5w,8009642,469,2023-07-20 20:03:37
678,nba,Observation: Ceilings are an incredibly overrated concept in projecting players,155trip,Autistic_Puppy,44,t3_155trip,8009642,40,2023-07-21 17:02:54
679,nba,"Pick Protections on the '29 First Round Pick that Denver Traded OKC (in exchange for the worst of OKC's '24 Firsts, a '24 Second and the '23 #37 pick) have finally been reported: protected top 5 in '29 and '30, and if doesn't convey it becomes a '30 Second.",155rium,joebreezy12,55,t3_155rium,8009642,47,2023-07-21 15:39:40
680,nba,"Grant Williams on what he said to Jimmy Butler on the Tidal League Run Your Race Pod; ""Jimmy (Butler) says 'Hell no, he ain't here!' So I made a 3, I said, 'Hell no, motherf**ker, I'm here!' ... The next play, Jimmy - hesi, boom boom, stop, pivot, and-1. And he said, 'I'm here too, motherf**ker!'""",155155i,almonakinvader,1957,t3_155155i,8009642,252,2023-07-20 19:46:56
681,nba,Allen Iverson might be the most overrated player in nba history,157b699,Ok-Price556,0,t3_157b699,8009642,62,2023-07-23 10:20:04
682,nba,Wembanyama is a real deal,15740rj,Crypto_soulmate,0,t3_15740rj,8009642,9,2023-07-23 03:42:46
683,nba,How high is the interest for EuroLeague among r/NBA users?,155wvxr,Mic161,24,t3_155wvxr,8009642,42,2023-07-21 19:01:31
684,nba,"Hypothetical Question - Is OKC the best placed for a Luka trade, if he were to demand for it?",156xsav,psychedelic93,0,t3_156xsav,8009642,45,2023-07-22 22:49:02
685,nba,Blake Griffin with the ridiculous pass which leads to an off the glass alley-oop finish by KD (2021),1556vtx,fantasticwarriors,882,t3_1556vtx,8009642,91,2023-07-20 23:28:16
686,nba,Move back the 3pt line?,156zmr3,Buttholes4Everyone,0,t3_156zmr3,8009642,48,2023-07-23 00:09:20
687,nba,"Grant Williams: “KD is the hardest person to guard in the league, by far...but Steph Curry is the most impactful player on a team in the league.""",1558h82,almonakinvader,705,t3_1558h82,8009642,172,2023-07-21 00:35:35
688,nba,"[Afseth] The Atlanta Hawks plan to waive Tyrese Martin ahead of his $1.7 million salary becoming fully guaranteed, per league sources. The 6-foot-6 guard averaged 1.3 points and 0.8 rebounds in 4.1 minutes per game last season.",155o1qm,Kimber80,59,t3_155o1qm,8009642,15,2023-07-21 13:27:34
689,nba,[Forsberg] Jaylen Brown here in Dorchester this morning for a court redesign at the Fenelon Street playground.,155rqt7,ChipotleGuacamole,40,t3_155rqt7,8009642,4,2023-07-21 15:47:55
690,nba,Who is your team and what current player is the worst fit for them?,155ulr0,DailyDisciplined,26,t3_155ulr0,8009642,53,2023-07-21 17:34:32
691,nba,build the perfect 5’11” NBA player,156m8un,joueaubasket1091,0,t3_156m8un,8009642,23,2023-07-22 14:55:49
692,nba,How much is Klay Thompson worth per year in an extension?,155oerd,ScottieBarn,55,t3_155oerd,8009642,167,2023-07-21 13:41:57
693,nba,"[Basketball Reference] Number of players to average 30+ PPG in a season for each active franchise: 3 – GSW, LAL, OKC, PHI, SAC, UTA 2 – ATL, HOU, LAC, MIL, WAS 1 – BOS, CHI, CLE, DAL, MIA, NYK, ORL, POR, SAS 0 – BRK, CHO, DEN, DET, IND, MEM, MIN, NOP, PHX, TOR",155tl0y,Kimber80,28,t3_155tl0y,8009642,23,2023-07-21 16:56:10
694,nba,"NBA trainer Tim Grover: This has only happened 4 times in the history of the NBA where one player has won the scoring title, MVP, was 1st Team All-Defense, led playoff in scoring and FMVP. You know who those 4 players were? Jordan, Jordan, Jordan, and Jordan",154v0mg,Barbell_Flyes,2603,t3_154v0mg,8009642,520,2023-07-20 16:01:49
695,nba,Anthony Davis Sinks Amazing Double-Pump Game-Winner To Secure Tie Breaker Over Thunder,1562c46,HoopsHistoryGuy,8,t3_1562c46,8009642,14,2023-07-21 22:28:36
696,nba,Jordan Poole staying ready in the boxing gym 🥊,1556090,Mechaultima,671,t3_1556090,8009642,171,2023-07-20 22:52:50
697,nba,Why didn’t Zhou Qi get more minutes. He was a beast,155yk4g,nakotamcc,16,t3_155yk4g,8009642,31,2023-07-21 20:04:22
698,nba,Which NBA Players Are As Good/Better Player Than Their Father's Were When They Were In the NBA?,1559d3e,CazOnReddit,412,t3_1559d3e,8009642,380,2023-07-21 01:16:37
699,nba,Prime Carmelo Anthony Scores 50 on all jumpers,155bgtj,psymin914,301,t3_155bgtj,8009642,71,2023-07-21 02:57:39
700,nba,[OKC Free Press] OKC Mayor Holt makes case for new NBA-level arena as Paycom Center becomes a growing liability’,155zfzw,_massaiwalker,11,t3_155zfzw,8009642,45,2023-07-21 20:37:38
701,nba,Last Call -- where do the remaining free agents fit?,155sgck,ZandrickEllison,22,t3_155sgck,8009642,18,2023-07-21 16:13:18
702,nba,Olden Polynice believes Victor Wembanyama's ceiling is Shawn Bradley,156fezl,kkpdp,0,t3_156fezl,8009642,25,2023-07-22 09:26:46
703,nba,"ESPN held talks with NBA, NFL in search for strategic partner, sources say",155uw29,TheGeoninja,17,t3_155uw29,8009642,21,2023-07-21 17:45:34
704,nba,Weekly Friday Self-Promotion and Fan Art Thread,155lzfs,NBA_MOD,47,t3_155lzfs,8009642,8,2023-07-21 12:00:21
705,nba,Nike needs to make an Air Joker 1 signature shoe.,156ua26,slicksonslick,0,t3_156ua26,8009642,8,2023-07-22 20:23:58
706,nba,How ‘The Last Dance’ Changed Sports Docs for Good,155vs5r,Piano_Fingerbanger,15,t3_155vs5r,8009642,64,2023-07-21 18:19:28
707,nba,How do you see the Cavs next season?,155rj8z,Marano94,21,t3_155rj8z,8009642,61,2023-07-21 15:40:07
708,nba,"Young Pat Riley explains Magic Johnson & Showtime Lakers' ""Fist-Up"" play",155besv,JohnLemonnn69,215,t3_155besv,8009642,27,2023-07-21 02:54:55
709,nba,"Who besides Russell Westbrook and Draymond Green, do you think is the most likely player to recreate something similar to the Malice at the Palice?",156xais,dmister8,0,t3_156xais,8009642,60,2023-07-22 22:27:59
710,nba,Elite Post Players Don’t Need to Shoot,156n8yc,joueaubasket1091,0,t3_156n8yc,8009642,20,2023-07-22 15:35:50
711,nba,The warriors don’t win a single championship without Draymond Green.,1573d6k,Sea_Credit_6275,0,t3_1573d6k,8009642,37,2023-07-23 03:08:35
712,nba,[Thinking Basketball] Super-draft of the last three classes.,155j842,ausernameforadam,50,t3_155j842,8009642,182,2023-07-21 09:43:50
713,nba,"[Charania] Oklahoma City’s Chet Holmgren and Jalen Williams, Detroit’s Cade Cunningham, Houston’s Jalen Green and Sacramento's Keegan Murray are among group of rising American stars who will join Team USA for FIBA World Cup training camp next month, per sources.",154uxq3,NokCha_,1192,t3_154uxq3,8009642,111,2023-07-20 15:59:13
714,nba,Slamball 2023 Schedule on Google Calendar,155u54f,travi19,11,t3_155u54f,8009642,5,2023-07-21 17:17:13
715,nba,[Mussatto] OKC Mayor David Holt says he'll pursue vote on new NBA arena with no tax increase,154zs9s,AnkitPancakes,618,t3_154zs9s,8009642,231,2023-07-20 18:56:12
716,nba,"[Wojnarowski] ESPN Sources: Pistons G Cade Cunningham — fully recovered from season-ending shin surgery in December— will practice and scrimmage for a USA Select team against the Senior Team USA roster bound for the FIBA World Cup. Cunningham was offered a spot on the World Cup roster, but ....",154uvjo,Kimber80,1031,t3_154uvjo,8009642,74,2023-07-20 15:56:52
717,nba,"Who is better all time, Demarcus Cousins or Yao Ming?",156sov2,searchformytongue,0,t3_156sov2,8009642,33,2023-07-22 19:18:53
718,nba,How come career totals never matter when it comes to bad stats?,156u9g8,FantasyG_,0,t3_156u9g8,8009642,46,2023-07-22 20:23:15
719,nba,"James Harden removes 76ers from Twitter bio, picture",154l1y6,Harrisontaker,3907,t3_154l1y6,8009642,664,2023-07-20 08:31:02
720,nba,"[Chiang] Someone that has knowledge of what’s going on is convinced that Portland doesn’t even want to trade Damian Lillard at this point. It almost feels like they’re trying to find a way to change his mind or delay this where Damian will say “Well, I’ll just be part of this.”",154pzow,lopea182,1581,t3_154pzow,8009642,692,2023-07-20 12:47:17
721,nba,"Most 10, 15, 20…. 60 point playoff games all time.",154qb06,AdorableBackground83,1504,t3_154qb06,8009642,669,2023-07-20 13:01:15
722,nba,TacoBell got so much free publicity from Jokic it’s insane.,156gdlk,HumanMan00,0,t3_156gdlk,8009642,14,2023-07-22 10:21:08
723,nba,"Assuming LeBron has a couple more great years (Top 20ish player)… he’ll end in with DOUBLE the amount of elite seasons as MJ. Does MJ get a free pass for the short career relative to other GOATs (e.g. Brady, Gretsky, Lebron)",156valu,this_place_stinks,0,t3_156valu,8009642,74,2023-07-22 21:05:43
724,nba,"NBA Newbie, Where do I Start?",155z8sz,Red-Knight25,4,t3_155z8sz,8009642,17,2023-07-21 20:30:02
725,nba,"Has leaving Houston been a negative for James Harden's ""legacy""",155v7jg,nervousaboutschool17,8,t3_155v7jg,8009642,33,2023-07-21 17:57:46
726,nba,2 Years Ago Today: Giannis scores a 50 piece along with 5 blocks and 17/19 from the line to lead the Bucks win their first NBA Title in 50 years.,154p30j,The_Sign_of_Zeta,1478,t3_154p30j,8009642,179,2023-07-20 12:05:35
727,nba,Who would win a best of 7 series between the 09-10 Lakers and the 19-20 Lakers?,156105h,stutterhouse,3,t3_156105h,8009642,46,2023-07-21 21:36:28
728,nba,Who's a better shooter Kelenna Azubuike or Daequan Cook?,156cvxl,PlatosLeftTit,0,t3_156cvxl,8009642,21,2023-07-22 07:02:14
729,nba,Obese Harden shows up and still drops 44 points and 17 assists on an opening night after requesting a trade.,154t08o,lengune,821,t3_154t08o,8009642,129,2023-07-20 14:48:41
730,nba,Do you think a team of 4 all-time players could beat a team of 5 horrible NBA players?,155xxx7,BrocChedSoup,6,t3_155xxx7,8009642,32,2023-07-21 19:40:54
731,nba,"[Highlight] 2013 Christmas Game. The Miami Heatles team doing their daily fan service, as LeBron destroys his future team with both hands",155a6ra,arcelios,103,t3_155a6ra,8009642,19,2023-07-21 01:55:36
732,nba,Kobe ranks 98th all time in steals per game. He ranks 190th all time in steal percentage. Isn't that a bit odd for a 12x All-Defensive Team (2nd most all time) Guard?,156tn0p,waynequit,0,t3_156tn0p,8009642,78,2023-07-22 19:57:52
733,nba,What is your All-Time favorite Starting 5 ?,155vdu5,Oliverson12,3,t3_155vdu5,8009642,78,2023-07-21 18:03:55
734,nba,Are we still purchasing the Grizzlies organization?,15587j8,krabbypattykrabs,129,t3_15587j8,8009642,23,2023-07-21 00:23:46
735,nba,Players that score the most amount of there total points from the free throw line:,154pis3,Mechaultima,1094,t3_154pis3,8009642,426,2023-07-20 12:25:52
736,nba,ELI5: How is trash talking not just bad sportsmanship?,156vc4z,MrAppleSpoink,0,t3_156vc4z,8009642,40,2023-07-22 21:07:27
737,nba,Lance Thomas Career High 24 Points/2 Threes Full Highlights (3/22/2015),155i5gh,zeriloa,26,t3_155i5gh,8009642,4,2023-07-21 08:45:45
738,nba,"[Iko] Marcus Smart’s advice to Jabari Smith Jr.: .. “Keep going. This game is not catered to any defensive player. Everything [offensive players] do, they’ll always get the benefit of the doubt and you’re always going to get scrutinized as the defensive player.”",154ucvv,Kimber80,530,t3_154ucvv,8009642,32,2023-07-20 15:38:16
739,nba,[Lowe] Simmons to be credited year he sat out,154ojae,sgamer,1061,t3_154ojae,8009642,400,2023-07-20 11:39:38
740,nba,Las Vegas Globetrotters - NBA Expansion Team?,1566a2f,SpiritKangaroo69,0,t3_1566a2f,8009642,18,2023-07-22 01:23:26
741,nba,Superstars that Steph Curry has eliminated in the playoffs. Does any other all-time great have a list even close to this impressive?,156wlh9,FantasyG_,0,t3_156wlh9,8009642,53,2023-07-22 21:59:23
742,nba,"[Katz] New York made contact with the Chicago about Zach LaVine but the asking price was “giant,” as one league source told | According to league sources who have talked business with them, the Wolves have set a sky-high price on KAT too. Knicks have not expressed any interest in trading for Towns",154qn06,NokCha_,704,t3_154qn06,8009642,317,2023-07-20 13:15:02
743,nba,Would you rather have James Harden or Clyde Drexler in their primes?,155u4pa,mxgicjohnson,4,t3_155u4pa,8009642,70,2023-07-21 17:16:48
744,nba,Vince Carter with one of the greatest dunks over 7 footer Frédéric Weis (2000),1554tj5,fantasticwarriors,138,t3_1554tj5,8009642,26,2023-07-20 22:05:16
745,nba,Has anyone seen this movie? please tell me about it,1564wtv,Otherwise_Form1315,0,t3_1564wtv,8009642,17,2023-07-22 00:19:41
746,nba,What are best examples of a Game series that highlights Matchup Problem,155jgxt,ArtisticCheck9416,13,t3_155jgxt,8009642,18,2023-07-21 09:57:20
747,nba,LeBron James 44 Pts 11 ast 11 reb vs Ben Simmons 27 pts 13 ast 15 reb - Full Highlights,1558iry,StormSaniWater,76,t3_1558iry,8009642,24,2023-07-21 00:37:33
748,nba,The Greatest Individual Scoring Game In NBA History,1564mrh,Limitless_solu,2,t3_1564mrh,8009642,4,2023-07-22 00:07:21
749,nba,"[Highlights] In 2019 Nikola Jokic had six game winners, all in classic Joker-style",154tafc,IdRatherBeLurking,442,t3_154tafc,8009642,52,2023-07-20 14:59:43
750,nba,Westbrooks mid range pull up the most unguardable shot all time.,156pg7y,DRob400,0,t3_156pg7y,8009642,45,2023-07-22 17:04:18
751,nba,[Serious] Why is it so crazy to suggest that Steph Curry is a top 5 player of all time?,156oxw5,AdulasMoonblade,0,t3_156oxw5,8009642,221,2023-07-22 16:44:15
752,nba,Paul Pierce Buries a 3 Pointer in Al Harrington's Face 2003 Celtics Eastern Conference Quarterfinal,154vrev,HoopsHistoryGuy,274,t3_154vrev,8009642,51,2023-07-20 16:28:47
753,nba,End the Supermax,154sryd,Skyyywalker215,385,t3_154sryd,8009642,398,2023-07-20 14:40:00
754,nba,(O.C)Coining terms on modern NBA players and personalities,1562zu3,Otherwise_Form1315,0,t3_1562zu3,8009642,6,2023-07-21 22:56:23
755,nba,"Kevin Durant Full Game 6 Highlights vs Spurs (2016.05.12) - 37 Pts, 9 Reb",155hfxr,kirphioc2004,18,t3_155hfxr,8009642,7,2023-07-21 08:05:55
756,nba,"[Almanza] OKC Mayor David Holt on the Paycom Center: ""Our downtown arena is simply not what it used to be... The building itself is a growing liability.""",154yr9y,Kimber80,187,t3_154yr9y,8009642,118,2023-07-20 18:18:30
757,nba,Attending Hall of Fame Enshrinement Ceremony,155j4rw,holy_tacos,10,t3_155j4rw,8009642,8,2023-07-21 09:38:43
758,nba,LeBron fans are much bigger fans of LeBron than Jordan fans are of Jordan,156u4qt,krabbypattykrabs,0,t3_156u4qt,8009642,71,2023-07-22 20:17:43
759,nba,"[Wojnarowski] Forward Ron Harper Jr., has agreed on a new two-way contract to the return to the Toronto Raptors, Drew Gross of @rocnationsports tells ESPN. Harper Jr., averaged 17 points and five rebounds in his rookie season with the Raptors’ G League affiliate.",1553z3l,WorldTwisting,98,t3_1553z3l,8009642,20,2023-07-20 21:32:40
760,nba,Jokic with two behind the back dribbles to get to the rim!,1551nou,GenericDarkFriend,127,t3_1551nou,8009642,18,2023-07-20 20:06:14
761,nba,Winning Time Season 2 | Official Trailer | Max,1552bjp,AutographedSnorkel,96,t3_1552bjp,8009642,53,2023-07-20 20:30:49
762,nba,r/NBA mentioned as source for topics on new Show Oddball w/Amin Elhassan and Charlotte Wilder. Reddit for topics mentioned a minute in and then r/nba mentioned specifically around 17 min mark,1565sw4,Jawkurt,0,t3_1565sw4,8009642,13,2023-07-22 01:01:02
763,nba,"Since it's the off-season, why not do some NBA trivia?",155cgrz,Camctrail,26,t3_155cgrz,8009642,27,2023-07-21 03:46:26
764,nba,"Who is the ""worst"" player capable of demanding a trade and actually having enough juice to get it?",155qo70,RohanEdwards,6,t3_155qo70,8009642,50,2023-07-21 15:08:01
765,nba,"Shai hits the insane 3 to tie the game, but Devonte’ Graham responds with the longest buzzer beater in NBA history (2021)",154d4f9,fantasticwarriors,3148,t3_154d4f9,8009642,148,2023-07-20 01:27:35
766,nba,"[Marc J. Spears] The Miami Heat has promoted Andy Elisburg to Executive Vice President. He originally joined the franchise in its inaugural 1988 season and recently served as Senior Vice President, Basketball Operations/General Manager for the last 10 years.",1551e3i,lopea182,97,t3_1551e3i,8009642,22,2023-07-20 19:56:33
767,nba,Chet and KG Meet at Summer League 2023,154wphb,MakeCocktailsNotWar,160,t3_154wphb,8009642,55,2023-07-20 17:03:23
768,nba,Was watching the 2001 NBA finals,154wpji,No_Plantain_5495,144,t3_154wpji,8009642,128,2023-07-20 17:03:27
769,nba,"[Charania] The Oklahoma City Thunder have waived Rudy Gay, sources tell @TheAthletic @Stadium.",154bnzv,Michael_B_Lopez,3130,t3_154bnzv,8009642,393,2023-07-20 00:21:00
770,nba,Pop is Gonna Do So Much Good with That New Contract.... and Wine. LOTS of wine.,15568wy,sundaybanking21,46,t3_15568wy,8009642,7,2023-07-20 23:02:30
771,nba,Steph Curry goes coast to coast with some nice handling and a reverse in his last regular season game at Oracle Arena,154y583,WhenItsHalfPastFive,115,t3_154y583,8009642,5,2023-07-20 17:56:17
772,nba,What’s your earliest nba memory,155f9s9,BrandonF2003,11,t3_155f9s9,8009642,76,2023-07-21 06:10:08
773,nba,Peja Stojakovic with one of the best passes you will ever see,154erxh,_Antonius,1728,t3_154erxh,8009642,155,2023-07-20 02:45:09
774,nba,"Michael Jordan falls, splits, and fades in the clutch - 1998 Eastern Conference Finals, Bulls vs. Pacers, Game 2.",154uql8,ToronoRapture,157,t3_154uql8,8009642,18,2023-07-20 15:51:50
775,nba,How come no one is talking about Alex Caruso?,156gp5g,Lumpy_Communication1,0,t3_156gp5g,8009642,27,2023-07-22 10:38:45
776,nba,the nuggets are the Chicago bulls of our generation,156opb6,Skioyors,0,t3_156opb6,8009642,33,2023-07-22 16:34:37
777,nba,Ralph Sampson with the mid-air catch and shoot game winner to eliminate the Lakers and move onto the 1986 Finals,154yr3w,iamgarron,82,t3_154yr3w,8009642,15,2023-07-20 18:18:19
778,nba,[All The Smoke] Austin Reaves states he gave Houston & San Antonio thought.,154wnk3,NYSOM-Mod,86,t3_154wnk3,8009642,53,2023-07-20 17:01:30
779,nba,"Report: Robert Williams III working on on-ball offense, being more 'selfish'",154xtgo,EarthWarping,71,t3_154xtgo,8009642,27,2023-07-20 17:44:35
