index,subreddit,title,id,author,score,name,subscribers,comments_number,time
0,nba,2023-24 NBA Free Agent Tracker,14nfzki,MC-Jdf,1256,t3_14nfzki,8009642,691,2023-06-30 23:47:53
1,nba,Jaylen Brown was asked what he plans to do with all the money from his new contract,15b2lzy,Far-Asparagus6416,1919,t3_15b2lzy,8009642,605,2023-07-27 13:58:34
2,nba,"LeBron James on Twitter: I want to thank the countless people sending my family love and prayers. We feel you and I’m so grateful. Everyone doing great. We have our family together, safe and healthy, and we feel your love.",15b5rhi,D09987766,994,t3_15b5rhi,8009642,84,2023-07-27 16:03:25
3,nba,Lebron and Steven Adams have different perspectives on living in the Bubble in 2020,15anjr0,ChokePaul3,10232,t3_15anjr0,8009642,1253,2023-07-27 01:03:36
4,nba,"""5 Years From Now"" threads from 5 years ago",15b3zal,WhenMachinesCry,332,t3_15b3zal,8009642,172,2023-07-27 14:53:14
5,nba,Steph Curry on Hot Ones !,15b46k8,Notalabel_4566,255,t3_15b46k8,8009642,94,2023-07-27 15:01:12
6,nba,Zion Williamson and his family sued for breach of contract after alleged failure to repay nearly $2M loan,15anntu,SmoothCalmMind,2985,t3_15anntu,8009642,450,2023-07-27 01:08:43
7,nba,"[Highlight] Down 3, series tied at 2-2 with 3.6 ticks remaining, the Suns give the ball to Raja Bell",15b3ar8,_Antonius,211,t3_15b3ar8,8009642,47,2023-07-27 14:25:49
8,nba,"Vlade Divac Wins $90,000 for Charity with a Half-Court Shot (2015).",15azazp,ToronoRapture,366,t3_15azazp,8009642,24,2023-07-27 11:25:11
9,nba,[Highlight] It's Showtime Duncan,15b0xd6,BasicAccount01,267,t3_15b0xd6,8009642,16,2023-07-27 12:43:46
10,nba,Who is a player you expect to have a breakthrough this season?,15b024d,Burner_num2,238,t3_15b024d,8009642,403,2023-07-27 12:02:43
11,nba,Jaylen Brown Plans to Develop 'Black Wall Street' in Boston With New $304 Million Supermax Contract,15b4cez,WaterPlug215,131,t3_15b4cez,8009642,162,2023-07-27 15:07:25
12,nba,"Excluding your own team, what NBA team’s title run was the most gratifying for you to watch?",15b57cn,lopea182,107,t3_15b57cn,8009642,285,2023-07-27 15:41:48
13,nba,Josh Smith's game-winning putback slam at the buzzer vs Orlando Magic (2010),15b5720,WhenMachinesCry,90,t3_15b5720,8009642,10,2023-07-27 15:41:29
14,nba,"[scotto] The San Antonio Spurs have signed No. 44 overall pick Sidy Cissoko to a three-year deal, league sources told @hoopshype . Cissoko is represented by @_tandemse and @YouFirstBasket .",15b52h8,Kimber80,60,t3_15b52h8,8009642,17,2023-07-27 15:36:29
15,nba,"When you were a kid, who was a player you thought was amazing but didn't find out until later was not very good?",15ar437,Regnarr,510,t3_15ar437,8009642,770,2023-07-27 03:53:57
16,nba,[Robb] Joe Mazzulla just confirmed Derrick White will start at point guard next year.,15aghs8,sewsgup,2008,t3_15aghs8,8009642,269,2023-07-26 20:16:37
17,nba,Earl Boykins Becomes the Shortest Player Ever to Score 30 points,15az8pv,MikeyBastard1,114,t3_15az8pv,8009642,20,2023-07-27 11:21:48
18,nba,John Trapp loses $5 to Wilt Chamberlain as he bets against Wilt's ability to swish a 4th 3-point hook shot in a row during a 1972 shoot-around practice.,15b6fw7,ToronoRapture,41,t3_15b6fw7,8009642,17,2023-07-27 16:30:32
19,nba,Tim Duncan hits one of his 5 career playoff 3 pointers to force a second overtime in Game 1 of the 2008 NBA playoffs against the Suns,15b6k9h,obvious_bot,38,t3_15b6k9h,8009642,13,2023-07-27 16:35:28
20,nba,Suns' Kevin Durant Says Adam Silver Smelled Marijuana on Him at Cannabis Meeting,15a5bk3,BucketOfTruthiness,6441,t3_15a5bk3,8009642,932,2023-07-26 13:03:47
21,nba,One of the coldest white boys to ever do it. You know you want White Chocolate’s greatest passes in your off season feed.,15b011y,PatrickMcC,76,t3_15b011y,8009642,38,2023-07-27 12:01:26
22,nba,"[Zach Lowe] Bruce Brown’s comment was met with some snark, but I will say that having spent a ton of time around the Nuggets particularly during the finals, people within the Nuggets brain of trust were saying that the toughest team they faced in the West was Minnesota.",15aiuth,Turbulent_Thanks_183,994,t3_15aiuth,8009642,336,2023-07-26 21:47:03
23,nba,"[Weiss] Extension talks dragged on for weeks, with the two sides landing on a fully guaranteed supermax deal. Brown didn’t get the player option, but he secured a trade kicker that will be the lesser of seven percent of unearned base compensation or $7 million, according to a league source.",15b4glb,tacko2020,36,t3_15b4glb,8009642,38,2023-07-27 15:12:18
24,nba,5’3” Muggsy Bogues has a higher career offensive rebounding rate than Kevin Durant.,15afmng,xpillindaass,1227,t3_15afmng,8009642,123,2023-07-26 19:43:47
25,nba,"Dikembe Mutombo's classic “No, no, no” defensive play (1997)",15a9nju,WhenMachinesCry,2465,t3_15a9nju,8009642,112,2023-07-26 15:57:50
26,nba,[Phillips] His disastrous ownership tenure is over — it’s time Michael Jordan fix his relationship with Charles Barkley,15b1zzx,OnlyMamaKnows,44,t3_15b1zzx,8009642,36,2023-07-27 13:31:45
27,nba,Carmelo Anthony egregious 3-second violation,15aetke,charley3fly,1290,t3_15aetke,8009642,121,2023-07-26 19:13:05
28,nba,Preseason odds to win the championship...1997 Bulls +100 (50%) 2018 Warriors -185 (65%),15amw3m,Rapey_Keebler_Elves,472,t3_15amw3m,8009642,231,2023-07-27 00:34:07
29,nba,"[Highlight] JR Smith, direct descendant of Orville Wright and Wilbur Wright, decides to murder Gary Neal",15b6shs,jaypooner,24,t3_15b6shs,8009642,4,2023-07-27 16:44:35
30,nba,"SLAM: When Beal first heard that the [Suns] deal was in play, he had his own questions. “I was like, Why are they trading Book? Like there’s no way that this is happening,” Beal says. But fast forward, he’s here, I’m here and Kevin’s here and DA's here.""",15ab235,sewsgup,1884,t3_15ab235,8009642,390,2023-07-26 16:51:35
31,nba,"Wade on choosing AI to present him into the Hall of Fame: ""Allen Iverson is somebody who gets forgotten for what he means to this game and what he means to a community and to a culture. And so, I want to bring that back to the front in the forefront and give him his flowers like he deserved.""",15a7ppo,sewsgup,2764,t3_15a7ppo,8009642,402,2023-07-26 14:42:15
32,nba,"Reggie Lewis died 30 years ago today, July 27 1993, after suffering sudden cardiac death at the age of 27",15atezl,CleverBunnyThief,165,t3_15atezl,8009642,60,2023-07-27 05:56:09
33,nba,Which record is more unbreakable. Wilt Chamberlain 100 point game or Muggsy bogues shortest player ever at 5'3 record?,15aeegp,Commandersforlife,1242,t3_15aeegp,8009642,462,2023-07-26 18:57:04
34,nba,Yao Ming (7'6) Gets Yammed On By Manu Ginobili (6'6),15b5ifs,Laszl0Panaflex,24,t3_15b5ifs,8009642,3,2023-07-27 15:54:03
35,nba,"In 1960, the Lakers plane carrying Elgin Baylor & the rest of the team lost electrical instruments during a blizzard, got lost & crash landed into a cornfield. The owner later said: “We know the officials are against us in the NBA…But now we know the Lord is trying to save us from dying.”",15aekzi,lord_of_the_bees,1006,t3_15aekzi,8009642,88,2023-07-26 19:03:40
36,nba,"[AP] LeBron James sends thanks, says family is 'safe and healthy' after Bronny's cardiac arrest",15b6icf,TheRealPdGaming,18,t3_15b6icf,8009642,1,2023-07-27 16:33:14
37,nba,"Steph Curry addressed the incident involving Draymond Green and Jordan Poole, and I still don't get what the hell he's talking about.",15arsss,krabbypattykrabs,165,t3_15arsss,8009642,190,2023-07-27 04:28:32
38,nba,They went hard on rookie MJ 🥶,15b2y87,thisismy4th-account,25,t3_15b2y87,8009642,21,2023-07-27 14:11:48
39,nba,[Holroyd] Channing Frye: Cavs tried to 'bait' Draymond during 2016 NBA Finals,15a39jx,cloverjoe,3114,t3_15a39jx,8009642,461,2023-07-26 11:32:30
40,nba,"[Haynes] Detroit Pistons and Zavier Simpson expected to finalize an agreement on a one-year deal, his agent Daniel Hazan of @hazansportsmgmt tells @NBAonTNT, @BleacherReport.",15b51xt,PlayaSlayaX,18,t3_15b51xt,8009642,2,2023-07-27 15:35:54
41,nba,"[Scotto] The Spurs considered offering Reaves a restricted free agency sheet worth $21 million per season, league sources told HoopsHype. Ultimately, however, the Spurs were scared off by the widespread belief that the Lakers would match any offer sheet for Reaves",15a7hpg,EarthWarping,1623,t3_15a7hpg,8009642,403,2023-07-26 14:33:28
42,nba,Jaylen Brown predicts he will have 5 championship before he turns 28,15b7xgh,BrianBurns58,11,t3_15b7xgh,8009642,17,2023-07-27 17:29:00
43,nba,It's depressing being a Kawhi Leonard fan,15b632r,Vegetable_Papaya6493,12,t3_15b632r,8009642,30,2023-07-27 16:16:15
44,nba,What players do you not like for irrational reasons?,15ahd12,pyritedoodle,432,t3_15ahd12,8009642,673,2023-07-26 20:50:08
45,nba,"Who will end up with the better career, James Harden or Joel Embiid?",15b5ded,FlochofBirds,14,t3_15b5ded,8009642,56,2023-07-27 15:48:24
46,nba,Celtics play by play broadcaster Mike Gorman to retire at end of season after calling 42 seasons,15a7pw7,horseshoeoverlook,1231,t3_15a7pw7,8009642,140,2023-07-26 14:42:25
47,nba,"[NBA Central] Ben Simmons is 100% healthy and is expected to compete for the starting PG job in Brooklyn, per @IanBegley",15b8n4d,Evilsj,7,t3_15b8n4d,8009642,14,2023-07-27 17:56:57
48,nba,"[Wojnarowski] Florida F Alex Fudge has agreed on a two-way contract with the Los Angeles Lakers, his agent Shayaun Saee of @OneLegacysports tells ESPN.",15ai3kn,Brady331,317,t3_15ai3kn,8009642,77,2023-07-26 21:18:02
49,nba,Kareem Abdul-Jabbar scores his only 3-pointer of his career (1987).,15acahn,ToronoRapture,582,t3_15acahn,8009642,44,2023-07-26 17:37:20
50,nba,Coach Woodson eating a fans chips (2015),15aajic,WhenMachinesCry,705,t3_15aajic,8009642,31,2023-07-26 16:31:21
51,nba,The most interesting story/player for your team,15b473x,KingVzn,12,t3_15b473x,8009642,35,2023-07-27 15:01:43
52,nba,Rajon Rondo with the fake lob to LeBron who fake blocks his layup,15b7oz7,stutterhouse,7,t3_15b7oz7,8009642,2,2023-07-27 17:19:58
53,nba,[ESPN] Zion and family sued by tech company over loan,15anp6h,keyskeysonvannuys,132,t3_15anp6h,8009642,47,2023-07-27 01:10:19
54,nba,[Abbot - Truehoop]Sudden cardiac arrest is a basketball problem,15b89lh,BcuzRacecar,6,t3_15b89lh,8009642,17,2023-07-27 17:41:55
55,nba,[Wind] Nikola Jokic is still celebrating winning the Duzijanca horse race.,15ad9ct,greenwhitehell,453,t3_15ad9ct,8009642,101,2023-07-26 18:13:38
56,nba,Who's a player you thought was a scrub only because you watched them when they were past their prime?,15ah98a,0IsMyHer0,278,t3_15ah98a,8009642,394,2023-07-26 20:46:00
57,nba,"[Wojnarowski] Forward Dominick Barlow is returning to the San Antonio Spurs on a two-way contract, Todd Ramasar of @LifeSportsAgncy tells ESPN.",15aqkka,PlayaSlayaX,76,t3_15aqkka,8009642,22,2023-07-27 03:26:22
58,nba,[Highlights] Mo Williams (Career-High) 52 pts vs Pacers,15b4wsl,shadow_spinner0,9,t3_15b4wsl,8009642,3,2023-07-27 15:30:23
59,nba,"People who don’t like the Jaylen Brown contract, what would you have rather Boston have done with the money instead?",15a4wzk,ActionJohnsun,997,t3_15a4wzk,8009642,791,2023-07-26 12:46:33
60,nba,Lebron James sends Nurkic to the Shadow Realm,15ah1fs,valiidiix,230,t3_15ah1fs,8009642,39,2023-07-26 20:37:26
61,nba,"2 years ago, Charles Barkley said James Harden is the best offensive player he has ever seen",15aojsp,lengune,90,t3_15aojsp,8009642,51,2023-07-27 01:50:11
62,nba,Give us VanGundyVision,15ah9lu,knuck_cuz_i_buck,218,t3_15ah9lu,8009642,35,2023-07-26 20:46:22
63,nba,"[All the Smoke Podcast] Ty Lue discusses the 2022-23 Clippers: ""I loved Russ since Day 1... he saved our season""",15apa5v,BasedChad69420,76,t3_15apa5v,8009642,51,2023-07-27 02:24:21
64,nba,"Top 10 SGs post-Jordan, peak-wise",15acih6,BigDaddyJuno,348,t3_15acih6,8009642,866,2023-07-26 17:45:36
65,nba,Players who led their teams throughout the entire playoffs in at least 4 of the 5 main stats en-route to a championship.,15a5bo2,AdorableBackground83,791,t3_15a5bo2,8009642,229,2023-07-26 13:03:56
66,nba,"Jackson: In 2010, MJ pushed out whoever was guarding Gerald Wallace & played with the 2nd team. He made the their confidence go through the roof & WE LOSE. He scored a couple points, talked shit & dunked on his way out. After that we made playoffs, finished #1 defense so he knew what he was doing",15a8g5r,Barbell_Flyes,519,t3_15a8g5r,8009642,110,2023-07-26 15:11:05
67,nba,What happened to Avery Bradley?,15aqgsv,Feisty-Nobody-6590,56,t3_15aqgsv,8009642,58,2023-07-27 03:21:06
68,nba,Jaylen Brown ready for expectations on and off the court that come with new contract,15b5od5,Overall-Relation-561,5,t3_15b5od5,8009642,0,2023-07-27 16:00:29
69,nba,Juancho Hernangomez signs a two-year deal with the Greek EuroLeague club Panathinaikos B.C.,15akco7,ACTPOCBET,118,t3_15akco7,8009642,22,2023-07-26 22:46:00
70,nba,Steph Curry documentary 'Underrated' underwhelms,15b7bx2,EarthWarping,4,t3_15b7bx2,8009642,31,2023-07-27 17:05:51
71,nba,Dion Waiters cooks the KD Warriors for 33pts and buries the game-winner.,15b867c,Flykidd47,3,t3_15b867c,8009642,7,2023-07-27 17:38:14
72,nba,What are some great non-Jordan playoff series from the Jordan era?,15auzaj,Otherwise_Form1315,18,t3_15auzaj,8009642,12,2023-07-27 07:24:03
73,nba,Stan Van Gundy impresses elderly ladies with his dribbling,15aeyns,Legitimate_Secret_79,163,t3_15aeyns,8009642,39,2023-07-26 19:18:35
74,nba,Who would you say are the toughest players in the league?,15b4wgm,Snypse,4,t3_15b4wgm,8009642,36,2023-07-27 15:30:04
75,nba,Kuzma with 40 points against the Knicks!,15b76ug,GenericDarkFriend,3,t3_15b76ug,8009642,6,2023-07-27 17:00:44
76,nba,Best possible alphabetical order lineup?,15b1k4g,AnduwinHS,5,t3_15b1k4g,8009642,27,2023-07-27 13:12:13
77,nba,"Jayson Tatum on Load Management: ""I don't decide 'shit we're playing the Hornets tonight Ima chill.' I only get to go to Charlotte two times a year. Somebody paid their money to watch me play...Big game [or] not big game, compete, play basketball. Don't take this shit for granted.""",159msd8,Brady331,8836,t3_159msd8,8009642,851,2023-07-25 22:09:39
78,nba,Who’s the best 1v1 defender of all time?,15avxp2,Ok_Nefariousness_452,13,t3_15avxp2,8009642,60,2023-07-27 08:19:23
79,nba,Carmelo Anthony with the easiest miss of all time,15afcvx,nakotamcc,130,t3_15afcvx,8009642,43,2023-07-26 19:33:20
80,nba,Dwayne Wade Breaks Rondo's Arm,15a79uz,BaileyHistory,325,t3_15a79uz,8009642,219,2023-07-26 14:24:52
81,nba,What are some lesser known great players that suffered an injury and faded into obscurity?,15b8oe6,MasterDan118,2,t3_15b8oe6,8009642,3,2023-07-27 17:58:22
82,nba,"Towns, Horford, Duarte in Dominican Republic player pool for Fiba World Cup",15anaof,cTheDeezy,45,t3_15anaof,8009642,11,2023-07-27 00:52:05
83,nba,Can anyone help me find some archival footage?,15b0k13,NuggetDude7142,5,t3_15b0k13,8009642,6,2023-07-27 12:26:24
84,nba,Who in this year's rookie class is that one prospect you're far higher on than everyone else.,15b6no1,Negative1Rainbowz,3,t3_15b6no1,8009642,18,2023-07-27 16:39:16
85,nba,"Anthony Edwards on what he’s looking forward to most next season: “Going back to the playoffs…I want to play the Warriors. Wherever they at, I want to get to them.” Reporter: “Why the Warriors?” Edwards: “Because Draymond talks so much trash.”",159nm4s,AashyLarry,4295,t3_159nm4s,8009642,367,2023-07-25 22:41:03
86,nba,Why More NBA Players Should Follow Kemba’s Example,15b5m7j,dkmegg22,2,t3_15b5m7j,8009642,1,2023-07-27 15:58:13
87,nba,OLD NBA REDDIT THREADS THROWBACK POST: 2022 EDITION,15aqqq3,Fcusjfnfmfkg,19,t3_15aqqq3,8009642,3,2023-07-27 03:35:05
88,nba,[ESPN First Take] Stephen A. Smith: “LeBron James is the most valuable athlete in the 4 major North American leagues.”,15alsbx,ParisLake2,36,t3_15alsbx,8009642,223,2023-07-26 23:45:46
89,nba,[Highlight] David Robinson Goes Coast to Coast,15a61eo,BasicAccount01,224,t3_15a61eo,8009642,70,2023-07-26 13:33:52
90,nba,"[Weiss] Jaylen Brown on the pressure that comes with his record deal: ""I don't shy away from pressure...I don’t think nobody has seen my best yet. So god willing, I will put my best foot forward.""",15agn5d,Kimber80,64,t3_15agn5d,8009642,28,2023-07-26 20:22:19
91,nba,"Kevin Durant Says ""Everyone Does It"" When it Comes to Marijuana in the NBA",159x9yt,JamesAsher12,837,t3_159x9yt,8009642,264,2023-07-26 06:06:21
92,nba,"[Nast] Tracy McGrady: And I don't understand for the life of me what James Harden is doing. He’s demanded a trade away from the reigning MVP! James has probably played with more Hall of Famers than anybody in the league, and he doesn't have a ring to show for it.",159nrsx,EarthWarping,3317,t3_159nrsx,8009642,704,2023-07-25 22:46:59
93,nba,"During their 9 seasons playing together, Michael Jordan finished higher than or tied with Scottie Pippen in DPOY voting 7/9 times, including 6/6 before his first retirement. Jordan was at least 7th in DPOY voting all 9 times.",15b8we7,honestnbafan,1,t3_15b8we7,8009642,0,2023-07-27 18:06:43
94,nba,You know you want Stromile Swift's Top 20 Dunks hitting your off season feed!,15a3cfw,PatrickMcC,252,t3_15a3cfw,8009642,66,2023-07-26 11:36:11
95,nba,Who are some of the best bench players in the NBA?,15b8584,ChosenDonu,1,t3_15b8584,8009642,14,2023-07-27 17:37:14
96,nba,"Jaylen Brown in 2014: ""My teacher said she will look me up in the Cobb county jail in 5 years .. Wow"" just signed the biggest contract in NBA history.",159k26s,Otherwise_Form1315,4209,t3_159k26s,8009642,795,2023-07-25 20:30:37
97,nba,Sam Dekker hits the deck vs Knicks (2016),15ad5d0,WhenMachinesCry,71,t3_15ad5d0,8009642,14,2023-07-26 18:09:35
98,nba,Stephen Curry Is On Fire While Eating Spicy Wings | Hot Ones,15b73sh,D09987766,2,t3_15b73sh,8009642,4,2023-07-27 16:57:16
99,nba,[Charania] USC All-American Bronny James collapsed on the court Monday and had a cardiac arrest. He was taken to the hospital and is now in stable condition and no longer in the ICU. Statement:,159a6h5,lopea182,18591,t3_159a6h5,8009642,4253,2023-07-25 14:31:26
100,nba,"Saudi $, a slippery slope",15b6n7m,hayzeusofcool,1,t3_15b6n7m,8009642,25,2023-07-27 16:38:47
101,nba,Western Conference Playoff Race,15ap0nb,Push-Famous,15,t3_15ap0nb,8009642,51,2023-07-27 02:11:52
102,nba,NBA on CBS 1970s FULL Theme Song.3gp,15amgpa,Intelligent-Lack-122,18,t3_15amgpa,8009642,10,2023-07-27 00:15:19
103,nba,Dominick Barlow stats,15b5zxj,89wjziwk18,0,t3_15b5zxj,8009642,2,2023-07-27 16:12:45
104,nba,The general consensus is that Scottie Pippen is better than Patrick Ewing all time. Why?,15b5w6s,Childish___Glover,2,t3_15b5w6s,8009642,47,2023-07-27 16:08:36
105,nba,Prime Ty Lawson obliterates Jodie Meeks ankles.,15a84wu,Flykidd47,101,t3_15a84wu,8009642,28,2023-07-26 14:59:22
106,nba,Prime Chris Paul lockdown defense,15acjsc,waynequit,58,t3_15acjsc,8009642,17,2023-07-26 17:46:52
107,nba,Who in your opinion is the most annoying player in the league before start of the 2023-24 NBA season?,15a9651,Acrobatic-Reaction-7,86,t3_15a9651,8009642,373,2023-07-26 15:39:29
108,nba,[‎Road Trippin'] Wembanyama or Chet For 1 Year? Ft. Trey Murphy,15aaqee,timetenfifty,71,t3_15aaqee,8009642,87,2023-07-26 16:38:56
109,nba,[Clip request] My favorite Lebron clip of all time.,15b4s46,csin,1,t3_15b4s46,8009642,8,2023-07-27 15:25:18
110,nba,"Rajon Rondo Full Highlights at Hornets (2015.11.23) - 14 Pts, 20 Ast, 8 Reb.",15agy16,HoopsHistoryGuy,30,t3_15agy16,8009642,6,2023-07-26 20:33:47
111,nba,Which Team do I support as a newcomer?,15b3xgk,Miran24_07,0,t3_15b3xgk,8009642,21,2023-07-27 14:51:09
112,nba,"Start, bench, cut one... NBA Coach Edition",15b3ht5,APOLLO_EiGhT,1,t3_15b3ht5,8009642,10,2023-07-27 14:33:28
113,nba,"[Spears] Jaylen Brown and the Boston Celtics have agreed on a five-year supermax extension worth up to $304 million, the richest contract in NBA history, his agent Jason Glushon of @GlushonSM tells ESPN.",159b1zj,NokCha_,6766,t3_159b1zj,8009642,2726,2023-07-25 15:04:33
114,nba,I still don't understand what happened here,159ky7i,Therealomerali,1717,t3_159ky7i,8009642,205,2023-07-25 21:01:35
115,nba,What would be your team's All-Time rotation to compete in today's modern NBA?,15aiebx,Noolish,17,t3_15aiebx,8009642,89,2023-07-26 21:29:44
116,nba,Which MVPs would be different if voted by today’s media?,15actuh,waynequit,33,t3_15actuh,8009642,89,2023-07-26 17:57:42
117,nba,"Jaylen Brown just signed NBA's first $300 million contract, so who could be first to reach $400 million? - CBSSports.com",15b19ea,Overall-Relation-561,0,t3_15b19ea,8009642,32,2023-07-27 12:59:35
118,nba,WNBA’s Riquna Williams out of Aces activities after felony domestic violence arrest in Las Vegas,15awrow,lostacoshermanos,2,t3_15awrow,8009642,28,2023-07-27 09:07:55
119,nba,Who is the next “greatest of all time”?,15b6k2h,badvibes777,0,t3_15b6k2h,8009642,50,2023-07-27 16:35:15
120,nba,Pistons broadcaster George Blaha might not know what a windmill dunk is (compilation),159omjc,srgntalpowell,976,t3_159omjc,8009642,83,2023-07-25 23:19:41
121,nba,The Rockets Have Been Using Jabari Smith Completely Wrong.,15aojlm,dkmegg22,8,t3_15aojlm,8009642,17,2023-07-27 01:49:58
122,nba,Anyone been to a Big3 game? Was it any fun?,15al95k,DetainTheFranzia,12,t3_15al95k,8009642,10,2023-07-26 23:23:17
123,nba,Zach Lowe on the Jaylen Brown contract: “I’ve had a couple people in opposing front offices tell me something along the lines of ‘Are the Celtics really gonna pay their 3rd or 4th or 5th best player all this money?’”,159hjop,xpillindaass,1861,t3_159hjop,8009642,548,2023-07-25 19:00:36
124,nba,[Highlight] Anthony Davis misses 2 clutch freethrows to put the game away and Jayson Tatum ties it,159t9wd,Plies-,405,t3_159t9wd,8009642,57,2023-07-26 02:43:23
125,nba,The time Robert Parish was arrested for marijuana possession,15a6x91,CleverBunnyThief,47,t3_15a6x91,8009642,18,2023-07-26 14:10:31
126,nba,Hawks-Magic in Mexico City on Nov. 9,15a5l3t,horseshoeoverlook,52,t3_15a5l3t,8009642,39,2023-07-26 13:15:10
127,nba,What categories of basketball have the clearest GOAT?,15ambs5,MrAppleSpoink,7,t3_15ambs5,8009642,150,2023-07-27 00:09:09
128,nba,[Highlight] Jayson Tatum fumbles the rebound leading to an ice cold Rajon Rondo game winner in the garden,159u7e1,jonbemerkin,322,t3_159u7e1,8009642,41,2023-07-26 03:27:13
129,nba,"10 years ago I posted here about my new video game Basketball GM, and it's still going strong in 2023",1597ovz,dumbmatter,4849,t3_1597ovz,8009642,433,2023-07-25 12:52:41
130,nba,ESPN NBA Power Rankings,15acmsj,Mechaultima,20,t3_15acmsj,8009642,124,2023-07-26 17:50:06
131,nba,Kuzma goes ballistic with 41 points in three quarters!,15abqt7,GenericDarkFriend,25,t3_15abqt7,8009642,7,2023-07-26 17:17:18
132,nba,"In summer 2013, Mavs OJ Mayo signed w/ Bucks, Bucks Monta Ellis signed w/ Mavs",15agxtb,Based_and_JPooled,13,t3_15agxtb,8009642,11,2023-07-26 20:33:32
133,nba,Results - Creating r/nba's 23-24 Power Rankings,15akapq,ChickenNugget012345,8,t3_15akapq,8009642,21,2023-07-26 22:43:47
134,nba,Who’s a player you think came before his time?,159t4hc,kev-haley,294,t3_159t4hc,8009642,374,2023-07-26 02:36:05
135,nba,Would it be against the rules for two players to pick up and move the ball handler?,15a8ub0,doodypoo,27,t3_15a8ub0,8009642,38,2023-07-26 15:26:32
136,nba,"The 2024 Olympics will start a year from now today, what is your dream team?",15akc45,Tagst,7,t3_15akc45,8009642,34,2023-07-26 22:45:27
137,nba,All of Jaylen Brown 8 turnovers in game 7 vs. the Miami Heat. 5/29/23,159cifs,reavesforthree,2019,t3_159cifs,8009642,321,2023-07-25 15:57:59
138,nba,[Highlight] Smush Parker dunks on 2-time reigning DPOY Ben Wallace (2006),15a95ct,_Antonius,25,t3_15a95ct,8009642,14,2023-07-26 15:38:36
139,nba,Why was Magic double teamed in the 1991 finals?,15a0j4m,Affectionate-Ad2081,83,t3_15a0j4m,8009642,32,2023-07-26 09:13:07
140,nba,Which position is hardest to rank 1-5 all time?,15awmph,Ok_Tomorrow2110,0,t3_15awmph,8009642,22,2023-07-27 09:00:14
141,nba,"[Kartje] It was just last July that Vince Iwuchukwu, then a five-star freshman, suffered cardiac arrest on the court and was saved by USC trainers. Horrifying to think this happened to one basketball team twice in the span of one year.",159ds2k,sewsgup,1651,t3_159ds2k,8009642,245,2023-07-25 16:44:15
142,nba,"Big game James Harden takes the rockets to their first WCF in 18 years G7 vs Clippers - 31 Pts, 8 Dimes, Rockets in WCF!",15agv1e,Aggressive-Ad-756,9,t3_15agv1e,8009642,13,2023-07-26 20:30:37
143,nba,"With his new extension, Jaylen Brown has a chance to earn over $700M in salary alone by the time he retires",159c4v2,Sihvel,1747,t3_159c4v2,8009642,381,2023-07-25 15:44:29
144,nba,"Basketball Immaculate Grid #2: July 26th, 2023",15afkkv,Metfan722,9,t3_15afkkv,8009642,19,2023-07-26 19:41:35
145,nba,43 year old Kareem Abdul-Jabbar guarding 21 year old Vlade Divac (1990).,159e1o3,ToronoRapture,1362,t3_159e1o3,8009642,138,2023-07-25 16:53:51
146,nba,The Best years of the NBA,15azkds,JobberStable,0,t3_15azkds,8009642,7,2023-07-27 11:38:34
147,nba,10 minutes of Logo Lillard Bombs,15acs3t,lucas_sawyer,15,t3_15acs3t,8009642,13,2023-07-26 17:55:44
148,nba,42-year-old Tim Duncan getting buckets vs Spurs forwards,159htgo,joshuamillertime,788,t3_159htgo,8009642,114,2023-07-25 19:09:56
149,nba,"[Himmelsbach] Per source, Jaylen Brown requested that instead of a formal press conference at Auerbach Center, his extension will be announced at his 7uice Bridge Program, a collab with MIT for minority high school students.",159d7fm,iksnet,1298,t3_159d7fm,8009642,211,2023-07-25 16:23:01
150,nba,"A very interesting article from 1968 that offers some insight into the later years of the West and Baylor Lakers teams of the 60s, with focus on the injuries both had suffered through the years of demanding play.",15acktk,amateurdormjanitor,10,t3_15acktk,8009642,1,2023-07-26 17:47:57
151,nba,Data breach victim being wrongfully sued by NBA,159z4yz,ab73030,66,t3_159z4yz,8009642,7,2023-07-26 07:53:01
