index,subreddit,title,id,author,score,name,subscribers,comments_number,time
152,nba,Tim Duncan gets ejected for laughing (2007),15972en,WhenMachinesCry,2281,t3_15972en,8009642,263,2023-07-25 12:26:27
153,nba,"Wilt ""The Record Book"" Chamberlain Player Guessing Game",159nqiq,Bitesh9,326,t3_159nqiq,8009642,32,2023-07-25 22:45:34
154,nba,"If there was no cap on salaries, how much would guys like LeBron, Curry, and Durant get at their peaks?",15ac1a7,CulturalRoll,10,t3_15ac1a7,8009642,23,2023-07-26 17:27:49
155,nba,Why is Mark Williams so Underrated?,159ybbp,vixgdx,68,t3_159ybbp,8009642,32,2023-07-26 07:05:32
156,nba,"""Somebody hits me, I'm going to hit him back. Even if it does look like he hasn't eaten in a couple weeks. I thought he was going to pull a spear on me."" - Charles Barkley when questioned about elbowing an Algerian player in the face during the olympics",159a6p8,WaterPlug215,1280,t3_159a6p8,8009642,387,2023-07-25 14:31:40
157,nba,The Cap Space Dilemma,15adhc5,Produceher,7,t3_15adhc5,8009642,31,2023-07-26 18:21:51
158,nba,What were some of your favorite dunks from players on your favorite team last season?,15an1wx,Next-Firefighter-753,3,t3_15an1wx,8009642,21,2023-07-27 00:41:09
159,nba,Coach Attire - Will coaches ever wear suits again?,15ah8c7,rgarc065,5,t3_15ah8c7,8009642,27,2023-07-26 20:45:09
160,nba,People are making the same mistake regarding the Jaylen Brown Contract that they did when he signed his previous contract,15agxw8,trapphilosopher12,6,t3_15agxw8,8009642,17,2023-07-26 20:33:37
161,nba,[Moreno] Nick Nurse wants to mold Paul Reed into a Pascal Siakam-type player:,159ilkb,EarthWarping,398,t3_159ilkb,8009642,101,2023-07-25 19:38:46
162,nba,Updated list on the most annoying players in the league to watch,15b3jmw,Acrobatic-Reaction-7,0,t3_15b3jmw,8009642,45,2023-07-27 14:35:33
163,nba,"Tracy McGrady: ""I've heard that for the last three years, that it was gonna be an expansion team out here in Las Vegas. I heard that LeBron James is going to be the owner of that. It's his team. I heard it through league channels.""",159kug9,sewsgup,300,t3_159kug9,8009642,88,2023-07-25 20:58:11
164,nba,Who is the best Beat Writer/Twitter follow for your favorite team?,15a7wwj,Ghostwriter574,10,t3_15a7wwj,8009642,31,2023-07-26 14:50:15
165,nba,"]Bleacher Report] ""Ben's my guy. I got big confidence, big faith in my boy this year."" Mikal Bridges talks Ben Simmons' upcoming return and being a support system for him 💯 (via @PodcastPShow )",159a7ia,Kimber80,932,t3_159a7ia,8009642,276,2023-07-25 14:32:30
166,nba,Nikola Jokić 2022-2023 Season Dunk Compilation,15a6qoa,IdRatherBeLurking,13,t3_15a6qoa,8009642,14,2023-07-26 14:02:58
167,nba,Max Contract Misconceptions + Jaylen Brown Extension,159t60f,r20c19,88,t3_159t60f,8009642,55,2023-07-26 02:38:16
168,nba,Jaylen Brown: the Forgotten Man in Zach Lowe's Supermax Calculus,15a9jzv,Think-Culture-4740,8,t3_15a9jzv,8009642,84,2023-07-26 15:54:04
169,nba,How would you rank these teams? (all-time teams for states/continents),15adjkh,Otherwise_Form1315,3,t3_15adjkh,8009642,20,2023-07-26 18:24:14
170,nba,[Karalis] I’m told Jaylen Brown’s contract has no player option and it’s fully guaranteed so there are no incentives. There is a trade kicker.,159cpl9,iksnet,489,t3_159cpl9,8009642,177,2023-07-25 16:04:56
171,nba,Who would win in a series between the Rockets or this team with the best defense/worse offense ever?,15az9mp,Fancy-Effective6725,0,t3_15az9mp,8009642,6,2023-07-27 11:23:06
172,nba,"RAPM, one of the best publicly available advance stats, has been around since the 2009-2010 season. Here's who the top 10 players in the league were in RAPM that season",15aamfd,VagabondReborn,4,t3_15aamfd,8009642,17,2023-07-26 16:34:30
173,nba,Mild Take: Tim MacMahon -- Worst Lowe Post Guest,159p8lt,mak223,110,t3_159p8lt,8009642,142,2023-07-25 23:43:58
174,nba,Richard Jefferson Tells You Why Gilbert Arenas ACTUALLY Got Drafted In The Second Round,159liwy,thatshirtman,161,t3_159liwy,8009642,30,2023-07-25 21:23:55
175,nba,Who are the 5 fastest players in the history of the NBA in your opinion,15andu5,FilmEater,3,t3_15andu5,8009642,70,2023-07-27 00:56:15
176,nba,"Steph Curry Drops PLAYOFF CAREER-HIGH 50 PTS In Warriors Game 7 W! #PLAYOFFMODE | April 30, 2023",15abvr0,dnshsnasnsnxn,6,t3_15abvr0,8009642,7,2023-07-26 17:22:09
177,nba,"Interesting perspective on Nikola Jokic missing World Cup: ""When you're the best player of a team you're always double-teamed, when you're the best in the world you're guarded by three players every game. You play 100 games in a season, you get beaten up for a 100 games. The man is not a machine.""",1594jjc,luksi1,1171,t3_1594jjc,8009642,180,2023-07-25 10:28:20
178,nba,/r/NBA Hall of Fame: Class of 2003,15adx0q,Sweden13,2,t3_15adx0q,8009642,6,2023-07-26 18:38:09
179,nba,Why does Perkins have a job?,15a0cg2,Affectionate-Ad2081,17,t3_15a0cg2,8009642,63,2023-07-26 09:02:27
180,nba,Who would be the better fusion player?,15axomh,Curious_Success_377,0,t3_15axomh,8009642,16,2023-07-27 09:59:48
181,nba,JR Smith forgets the score and denies the Cavs the chance to steal game 1 of the 2018 finals,159a2yc,yungsantaclaus,495,t3_159a2yc,8009642,189,2023-07-25 14:27:51
182,nba,Court side seats,15am46e,Hauntedgreenhouse,0,t3_15am46e,8009642,19,2023-07-26 23:59:57
183,nba,Golden State Warriors: Chris Paul expects to ‘thrive’ next to Draymond Green,159qbrw,EarthWarping,72,t3_159qbrw,8009642,66,2023-07-26 00:29:13
184,nba,"[Pompey] Sixers center Paul Reed on James Harden’s trade request: ""James Harden, that’s like my big brother, one of the coolest vets I know. I hope he comes back. But I understand business is business, and sometimes you got to do what you got to do...",159dono,Kimber80,316,t3_159dono,8009642,63,2023-07-25 16:40:43
185,nba,Is the last decade or so known as the LeBron era or the Curry era?,15b6y95,FantasyG_,0,t3_15b6y95,8009642,102,2023-07-27 16:50:55
186,nba,Jimmy Butler ends his China tour stopping in Hong Kong and picks the Heat to win 2024 Finals,159nmig,Barbell_Flyes,94,t3_159nmig,8009642,27,2023-07-25 22:41:24
187,nba,In your opinion how many NBA players right now are top 10 all time at their respective position?,159qdzy,FilmEater,61,t3_159qdzy,8009642,144,2023-07-26 00:31:47
188,nba,The Sky is the Limit for LaMelo Ball | NBA Player Profile: Future Stars,15ak0rw,KalebC21,2,t3_15ak0rw,8009642,3,2023-07-26 22:32:29
189,nba,[Lebron James] Me headed to Saudi when they call @RichPaul4 & @mavcarter for that 1 year deal! ✌🏾🤷🏾‍♂️😁,158scnw,Both_Funny4896,5189,t3_158scnw,8009642,1577,2023-07-25 00:32:14
190,nba,Jaylen Brown will be the 12th player to sign a Super-Max contract,159es7y,nowhathappenedwas,161,t3_159es7y,8009642,98,2023-07-25 17:20:16
191,nba,[Cato] Key figures within the Dallas Mavericks have spoken to superstar Luka Doncic about decreasing his preferred playing weight this summer,158uc2w,BayonettaBasher,2672,t3_158uc2w,8009642,467,2023-07-25 01:58:21
192,nba,"Naz turned down 4 for $63 million from Cleveland, according to Dane Moore",15920at,42Vert,811,t3_15920at,8009642,228,2023-07-25 08:18:06
193,nba,Who would you rather have?,15ato2y,89wjziwk18,0,t3_15ato2y,8009642,10,2023-07-27 06:09:59
194,nba,Win shares per win,15aa87i,heardThereWasFood,1,t3_15aa87i,8009642,14,2023-07-26 16:19:50
195,nba,Video of Tim Duncan Outlet Passes set to Slow Jamz,159k3zf,sunbomb,76,t3_159k3zf,8009642,15,2023-07-25 20:32:21
196,nba,What would your favorite team's all decade starting 5 be,159vg24,brick-young,17,t3_159vg24,8009642,96,2023-07-26 04:29:07
197,nba,Has Jayson Tatum surpassed Peak Paul George?,15aflkt,stefanfan101,2,t3_15aflkt,8009642,43,2023-07-26 19:42:38
198,nba,Which player would have the biggest drop off in defensive value in the modern NBA?,15a0eo5,Affectionate-Ad2081,7,t3_15a0eo5,8009642,14,2023-07-26 09:05:49
199,nba,James Harden Trade Rumors: Clippers 'Reluctant' to Deal Terance Mann in 76ers Talks,159mt2x,ethereal3xp,49,t3_159mt2x,8009642,124,2023-07-25 22:10:19
200,nba,Kid asks Kyle Kuzma where Kyle Kuzma is at Kyle Kuzma camp,158pldw,nervousaboutschool17,4042,t3_158pldw,8009642,165,2023-07-24 22:40:16
201,nba,MJ dunks on Patrick Ewing (1991 Playoffs),159j563,WhenMachinesCry,77,t3_159j563,8009644,18,2023-07-25 19:57:54
202,nba,Do you think Kevin Durant will be remembered more for his generational talent or move to the Warriors?,15anuvx,CulturalRoll,0,t3_15anuvx,8009644,111,2023-07-27 01:17:40
203,nba,What would a prospective NBA player need to do to be widely regarded as the new GOAT?,159t8zv,earthgrasshopperlog,21,t3_159t8zv,8009644,148,2023-07-26 02:42:09
204,nba,Nba jersey body camera,15aeqfj,Former-Link5646,0,t3_15aeqfj,8009644,9,2023-07-26 19:09:37
205,nba,Harden’s All-time Starting 5 Lineup (from USATODAY interview),15996eo,D09987766,215,t3_15996eo,8009644,130,2023-07-25 13:53:02
206,nba,Reggie Miller has no idea what a pun is,159b87b,MettaWorldConflict,164,t3_159b87b,8009644,34,2023-07-25 15:10:54
207,nba,Who would you rather have?,15asbxf,Curious_Success_377,0,t3_15asbxf,8009644,20,2023-07-27 04:56:54
208,nba,Does Dominick Barlow move the needle for the spurs?,15at0xb,89wjziwk18,0,t3_15at0xb,8009644,15,2023-07-27 05:34:27
209,nba,The Sixers should trade back for David Roddy,15apzpb,WatchMe_Nene,0,t3_15apzpb,8009644,8,2023-07-27 02:58:51
210,nba,Help me pick a team,15anrfq,Striking_Leopard_179,0,t3_15anrfq,8009644,28,2023-07-27 01:13:09
211,nba,What are some of the greatest NBA quotes of all time?,158yumx,greenMonstah__,763,t3_158yumx,8009644,607,2023-07-25 05:31:51
212,nba,Which player would you rather have?,15aq501,Relative-Context-620,0,t3_15aq501,8009644,19,2023-07-27 03:05:35
213,nba,[Giannis Antetokonmpo] Al Hilal you can take me. I look like Kylian Mbappe 😂😂👀,158jj7l,WhenItsHalfPastFive,5369,t3_158jj7l,8009644,710,2023-07-24 18:58:22
214,nba,NBA's highest yearly salary is Curry at $48 million. Mbappe just got offered $775 million yearly salary to play in Saudi Arabia.,158eo95,Legitimate_Secret_79,11645,t3_158eo95,8009644,3208,2023-07-24 15:59:25
215,nba,"6 different players have won Finals MVP in the last 6 seasons(KD, Kawhi, LeBron, Giannis, Steph, Jokic in order.) The last time we had 7 different FMVPs in a row was 1985-1991(the end of the Kareem/Magic/Bird era to the start of the MJ era.) Do you think this will be matched next season?",159fcwf,honestnbafan,73,t3_159fcwf,8009644,40,2023-07-25 17:41:19
216,nba,Jordan Clarkson to play as a naturalized player for the Philippines at the 2023 FIBA World Cup,1592nzo,JohnLemonnn69,373,t3_1592nzo,8009644,74,2023-07-25 08:52:39
217,nba,Immaculate Grid Basketball is here 🏀,159cjrf,SportsReference,98,t3_159cjrf,8009644,71,2023-07-25 15:59:25
218,nba,Name that lottery bust that you thought FOR SURE was going to be a stud.,158t478,thedudester125,1413,t3_158t478,8009644,1589,2023-07-25 01:05:17
219,nba,Who was Celts main competition to sign Jaylen Brown?,15apyzj,NBA_H8er,0,t3_15apyzj,8009644,20,2023-07-27 02:57:51
220,nba,8 Minutes of Jaylen Brown Dribbling,159f6jn,wwaldi,63,t3_159f6jn,8009644,64,2023-07-25 17:34:45
221,nba,The Magic of Pop,159pljc,2008and1,21,t3_159pljc,8009644,0,2023-07-25 23:58:46
222,nba,"Popular NBA news aggregator account changes Twitter tag to remove ""NBA"" from its name",159iw27,sewsgup,43,t3_159iw27,8009644,17,2023-07-25 19:49:10
223,nba,"Steph names the players without rings he would give his rings to, if he could",158rqsj,sriracha82,1504,t3_158rqsj,8009644,202,2023-07-25 00:06:58
224,nba,CLUTCH Manu Ginobili Wins The Game On Both Ends,159c0hk,Laszl0Panaflex,85,t3_159c0hk,8009644,7,2023-07-25 15:40:02
225,nba,"Without considering contracts, who’s better Jordan Poole, Ayton, Austin Reaves, derrick white",15aoz8c,_Pho-Dac-Biet_,0,t3_15aoz8c,8009644,49,2023-07-27 02:10:11
226,nba,Bam Adebayo or KAT?,15apncz,FlochofBirds,0,t3_15apncz,8009644,112,2023-07-27 02:41:33
227,nba,Pelicans Unveil New Alternate Uniform For 2023-24 Season,159lqzc,TowerOwl1939,26,t3_159lqzc,8009644,31,2023-07-25 21:32:39
228,nba,Clyde Drexler's Top 10 Career Glides,1595s5q,lolminna,168,t3_1595s5q,8009644,34,2023-07-25 11:28:14
229,nba,What if Michael Jordan never existed?,15ammkw,_rush2112,0,t3_15ammkw,8009644,77,2023-07-27 00:22:29
230,nba,"Brunson, Mitchell or Lillard for the next 3 years?",15adi8d,nikop,0,t3_15adi8d,8009644,50,2023-07-26 18:22:47
231,nba,NBA free throw legend Chuck Hayes mixtape,159cdf3,WhenMachinesCry,59,t3_159cdf3,8009644,14,2023-07-25 15:52:49
232,nba,Doesn't a Supermax with a trade kicker defeat the purpose of the Supermax?,159ht3o,astroK120,33,t3_159ht3o,8009644,13,2023-07-25 19:09:32
233,nba,Which championship team fell off?,15a64d7,DonT012,2,t3_15a64d7,8009644,34,2023-07-26 13:37:23
234,nba,[Draymond Green] They got basketball leagues too right? 😱😱🏃🏿🏃🏿💨💨💨💨💨 I don’t the ink on my contract has dried up yet 🤣🤣🤣🤣,158t6ca,Both_Funny4896,818,t3_158t6ca,8009644,363,2023-07-25 01:07:52
235,nba,Serious discussion question: In what ways are Devin Booker and Bradley Beal different?,15aensq,TotalReflection,0,t3_15aensq,8009644,30,2023-07-26 19:06:38
236,nba,[Stein] The Pistons’ are determined to ease a backcourt logjam by trading PG Killian Hayes. Trade talks between the Mavericks gained 'little traction'.,158x2zu,CazOnReddit,412,t3_158x2zu,8009644,150,2023-07-25 04:02:22
237,nba,Tim Duncan talks to Lebron after the 2007 finals,1594k8v,yungsantaclaus,126,t3_1594k8v,8009644,35,2023-07-25 10:29:25
238,nba,What does Cory Joseph bring to the Warriors?,159kp17,valiidiix,20,t3_159kp17,8009644,51,2023-07-25 20:52:51
239,nba,"In 2018 Austin Rivers was traded to the Suns. He didn't join the team and refused to play for them, then got bought out.",158im9c,achickenquesadilla,2299,t3_158im9c,8009644,262,2023-07-24 18:25:12
240,nba,Wolves Forward Li Kai'er published first weibo video,15924xn,Ecowatchib,167,t3_15924xn,8009644,86,2023-07-25 08:24:44
241,nba,2-year-old grandson of Bucks coach Adrian Griffin dies in Illinois,158r553,AnonymousFroggies,830,t3_158r553,8009644,149,2023-07-24 23:42:09
242,nba,r/NBA reaches 8 million subscribers!,159ncop,Tundraaa,11,t3_159ncop,8009644,30,2023-07-25 22:31:02
243,nba,I haven't watched the NBA since 2004. What happened to travelling?,15apdk4,ar243,0,t3_15apdk4,8009644,30,2023-07-27 02:28:47
244,nba,Anyone know any tv shows or youtube series where I can learn nba history,159i2y3,notkevindurant2,18,t3_159i2y3,8009644,30,2023-07-25 19:19:38
245,nba,Why do fans use team success to evaluate individual players?,159pxo5,achyutthegoat,5,t3_159pxo5,8009644,89,2023-07-26 00:12:21
246,nba,With all the jokes about jaylen brown being unable to dribble with his off-hand this off-season…,159ptjp,joesmith2024,5,t3_159ptjp,8009644,4,2023-07-26 00:07:29
247,nba,Who are some “Now that’s a name I haven’t heard in a while” players from the last 15 years?,158sfi3,itsjustanotheralt83,484,t3_158sfi3,8009644,1152,2023-07-25 00:35:36
248,nba,"Harden on Lillard/player empowerment: ""I wouldn't want an org to send someone somewhere they wouldn't want to be bc you've built a real relationship w/ that person. He has done so many great things for your franchise. But then you don't want to give away that player for nothing. I get both sides.""",158tvlj,FultzShoulder,391,t3_158tvlj,8009644,84,2023-07-25 01:38:11
249,nba,[Highlight] The Kevin Garnett and Antonio McDyess kerfuffle where KG kinda runs away,1598fg8,_Antonius,43,t3_1598fg8,8009644,59,2023-07-25 13:22:36
250,nba,"Tobias Harris goes off with 37 points [Wizards @ 76ers, Game 1]",159jn23,GenericDarkFriend,14,t3_159jn23,8009644,7,2023-07-25 20:15:23
251,nba,[New Orleans Pelicans] New Orleans state of mind. Statement edition jerseys drop August 1st 🌙,1599n0d,Briguy_fieri,35,t3_1599n0d,8009644,34,2023-07-25 14:10:46
252,nba,[Highlights] OG Anunoby 32 pts 10 rebs 3 asts vs Heat,159dzga,thissiteisbroken,20,t3_159dzga,8009644,10,2023-07-25 16:51:33
253,nba,Forgotten teams of the last 25 years?,159hu9h,zaraf_b3ngal,11,t3_159hu9h,8009644,25,2023-07-25 19:10:39
254,nba,Karl Anthony Towns's 4 year 234m contract will seriously hinder the chances of the Timberwolves winning a title,15ak2nr,Ok_Lobster_3166,0,t3_15ak2nr,8009644,85,2023-07-26 22:34:42
255,nba,"[ClutchPoints] ""If you were a free agent, then you could choose where you were gonna go… This started with James [Harden] and Ben [Simmons] and all these guys doing this sh*t. It's bad for the league."" Austin Rivers on Damian Lillard's trade demand (via ringernba/TT)",1588f73,Kimber80,3989,t3_1588f73,8009644,1206,2023-07-24 11:49:39
256,nba,Kevin Garnett running the court 1-on-1 vs Team USA teammates in a small gym in Australia (2000),158dbme,WhenMachinesCry,2041,t3_158dbme,8009644,279,2023-07-24 15:07:47
257,nba,2022-24 Isolation Efficiency,159fsjj,IMKudaimi123,12,t3_159fsjj,8009644,27,2023-07-25 17:57:00
258,nba,The reasons for Kyrie wearing #11 are wild,15ab7w1,ArrayMichael7,0,t3_15ab7w1,8009644,23,2023-07-26 16:57:43
259,nba,What are some players with team-friendly contracts?,159gq7e,northernjigby,10,t3_159gq7e,8009644,65,2023-07-25 18:30:44
260,nba,All-Time Roster for your team?,159cavh,100101110111,19,t3_159cavh,8009644,81,2023-07-25 15:50:17
261,nba,NBA Trades: Could Pascal Siakam Land in Oklahoma City?,159avyc,Harrisontaker,25,t3_159avyc,8009644,55,2023-07-25 14:58:44
262,nba,What is an nba take do you see/hear that immediately makes you believe that person doesn’t watch any games or is a casual fan?,158hpn5,obi-wan-ginobli-93,989,t3_158hpn5,8009644,1621,2023-07-24 17:50:24
263,nba,You are guaranteed 15 years of Jimmy Butler or Paul Pierce to start a franchise. Who do you pick? From rookie to 15 years into their careers. Who is a better player and who would you pick?,158xpju,throwaway561298,134,t3_158xpju,8009644,503,2023-07-25 04:33:03
264,nba,Players that were snubbed from the all-star game for their career,159xzr1,Madterps2021,0,t3_159xzr1,8009644,11,2023-07-26 06:47:29
265,nba,"Jordan sinks a jumper off a Rodman pick in the Eastern Conference First Round, Bulls vs. Nets, Game 1. (1998).",1592ug8,ToronoRapture,58,t3_1592ug8,8009644,15,2023-07-25 09:01:47
266,nba,2008 Team USA having a meal at a gas station,158gl87,fantasticwarriors,1003,t3_158gl87,8009644,149,2023-07-24 17:09:18
267,nba,Nikola Jokic celebrates another win for his horses!,158pakk,IdRatherBeLurking,335,t3_158pakk,8009644,34,2023-07-24 22:28:49
268,nba,Joker with the only trophy that matters (to him),158g2hd,Burner_num2,897,t3_158g2hd,8009644,182,2023-07-24 16:50:44
269,nba,The NBA if players stayed on teams longer,15afeft,brick-young,0,t3_15afeft,8009644,10,2023-07-26 19:35:05
270,nba,Part d. of Section VII of Rule No. 6: Putting the Ball in Play - Live/Dead Ball is incomplete in the online version of the rulebook. How would you finish it?,159m7e1,TheNatureBoy,2,t3_159m7e1,8009644,4,2023-07-25 21:48:44
271,nba,"Austin Rivers Says Damian Lillard Requesting A Trade Is ""Bad"" For NBA",158afay,ethereal3xp,1608,t3_158afay,8009644,395,2023-07-24 13:16:37
272,nba,Jaylen Brown’s Historic Supermax Is a Champagne Problem,15a4vbr,Piano_Fingerbanger,0,t3_15a4vbr,8009644,20,2023-07-26 12:44:42
273,nba,"Would Melo, Wade or Bosh really have been able to succeed under Larry Brown?",159fng8,vleck_da_wreck,7,t3_159fng8,8009644,28,2023-07-25 17:51:55
274,nba,Double standards in the Curry vs Magic debate,15alur7,FantasyG_,0,t3_15alur7,8009644,80,2023-07-26 23:48:33
275,nba,"[Bontemps] “I don't think there's any chance he signs an extension there [Cleveland] ever, and if it was up to me I would trade Donovan Mitchell today. ”",158du66,lopea182,878,t3_158du66,8009644,527,2023-07-24 15:27:27
276,nba,What’s the best argument for Kobe Bryant being a top 5 player of all time?,15a9y6a,Autistic_Puppy,0,t3_15a9y6a,8009644,209,2023-07-26 16:08:49
277,nba,Interesting articles on Wilt Chamberlain almost a year before he got traded,1590qil,xxStayFly81xx,48,t3_1590qil,8009644,17,2023-07-25 07:11:40
278,nba,Space to share NBA edits?,159uoa7,Embarrassed-Pop-3945,0,t3_159uoa7,8009644,3,2023-07-26 03:50:42
279,nba,Different Jerseys,159eo6l,Gorbranskes,5,t3_159eo6l,8009644,9,2023-07-25 17:16:03
280,nba,"In 2017, The Clippers employees wore this iconic t-shirt before trading blake griffin to Detroit Pistons",158au0q,OKCDraftPick2028,1110,t3_158au0q,8009644,227,2023-07-24 13:32:56
281,nba,If Saudi Arabia starting throw boatloads of money at NBA players to play there what current NBA starters would be most tempted to go?,158n1s7,Belegheru,277,t3_158n1s7,8009644,394,2023-07-24 21:04:44
282,nba,What defensive adjustments could the suns have made in the 1993 finals to contain MJ?,15a0p53,Affectionate-Ad2081,0,t3_15a0p53,8009644,20,2023-07-26 09:22:54
283,nba,"Draymond Green commits an unnecessary flagrant foul on the last possession of a First Round Game 3 matchup. Later, Green would be suspended for Game 5 of the 2016 NBA Finals due to flagrant points accrued",158ntzi,darkest__timeline,237,t3_158ntzi,8009644,58,2023-07-24 21:32:58
284,nba,Arguably Bron and MJ are Top 2 best players in NBA history. Who’s the 3rd?,15afezn,MamiTarantina,0,t3_15afezn,8009644,104,2023-07-26 19:35:37
285,nba,"NHL passerby here. For those who also watch NHL, who is the NBA equivalent of Pierre-Luc Dubois?",159hp4l,ImmaBestBoy,3,t3_159hp4l,8009644,11,2023-07-25 19:05:38
286,nba,Who are the best players to never have been named an All-Star?,159ff3a,WordNahMean,5,t3_159ff3a,8009644,86,2023-07-25 17:43:29
287,nba,Fun ads of Kobe competing with Messi,1590lnu,mr_pelinka,36,t3_1590lnu,8009644,5,2023-07-25 07:04:36
288,nba,[Pierce] I never compared myself to Dwayne wade I was ask a question how would u answer if u was me I would never disrespect him he is an all time great… the narrative surrounding me would be different if I was lucky enough to play with all timers earlier in my career…,158b5ec,AashyLarry,841,t3_158b5ec,8009644,665,2023-07-24 13:45:33
289,nba,"With the Nuggets championship, there are 10 franchises remaining that have never won a ring. Which of them do you think has a realistic shot at winning it in the near future?",158hrbh,AdulasMoonblade,375,t3_158hrbh,8009644,205,2023-07-24 17:52:00
290,nba,Omri Casspi duels Steph Curry in a wild three point shootout and lives to tell the tale.,158fqj2,stutterhouse,429,t3_158fqj2,8009644,42,2023-07-24 16:38:19
291,nba,[NBA University] Lowest FG% on half-court drives (min 6 per game) 1. Bones—35.9 2. Dort—40.2% 3. Killian—40.5% 4. LaMelo—40.9% 5. Anunoby—41.4% 6. Sochan—41.9% 7. Maledon—42.9% 8. Tre Mann—43.2% 9. Vassell—43.3% 10. LeVert/Payne—43.9%,158r7wc,EarthWarping,111,t3_158r7wc,8009644,67,2023-07-24 23:45:19
292,nba,2011-14 Pacers vs 2015-17 Rockets,159dfyo,NewPancakeMan,6,t3_159dfyo,8009644,22,2023-07-25 16:31:43
293,nba,Why is Steph Curry held to a much higher standard than Lebron James?,15ao8ag,FantasyG_,0,t3_15ao8ag,8009644,119,2023-07-27 01:35:08
294,nba,Which backcourt would you rather have: Kyle Lowry and Demar Derozan or Chauncey Billups and Richard Hamilton?,159zqet,Otherwise_Form1315,0,t3_159zqet,8009644,18,2023-07-26 08:27:03
295,nba,"""Smallball"" may be dying -- are we evolving into an era that should be called ""Longball"" ?",158egyw,ZandrickEllison,392,t3_158egyw,8009644,173,2023-07-24 15:51:44
296,nba,Bobby Portis stops CP3 from screaming at a ref,158n2su,GenericDarkFriend,139,t3_158n2su,8009644,18,2023-07-24 21:05:41
297,nba,Top 250 Players (Careers + Peaks): #206-220 (OC),159j5vk,Naismythology,3,t3_159j5vk,8009644,7,2023-07-25 19:58:38
298,nba,Steve Francis toys with Troy Hudson (2000).,158blaw,ToronoRapture,457,t3_158blaw,8009644,49,2023-07-24 14:02:56
299,nba,"""23 VS. 39"" | Michael Jordan Gatorade Commercial",158i3qg,qtrikki,218,t3_158i3qg,8009644,26,2023-07-24 18:04:21
300,nba,Awesome God ft. Kobe Bryant,159iapq,Plastic-Dot-9278,3,t3_159iapq,8009644,7,2023-07-25 19:27:29
301,nba,"If the NBA kept it's current rosters and flipped to being an Ultimate Frisbee league for the 23/24 season, which team would be favourites?",158h30s,JohnmcFox,242,t3_158h30s,8009642,113,2023-07-24 17:27:21
302,nba,Boston Celtics 2009 Opening Night Ring Ceremony,1599nha,CleverBunnyThief,7,t3_1599nha,8009642,8,2023-07-25 14:11:16
303,nba,"About 5 years ago, espn got rid of all comment sections to their articles",158wbvc,Inside-Pen-301,35,t3_158wbvc,8009642,23,2023-07-25 03:27:10
304,nba,Jimmy Butler is Not the One to Lead the Miami Heat,15a7heq,Ball3r51,0,t3_15a7heq,8009642,28,2023-07-26 14:33:10
305,nba,If each team could add one legend at their prime to the current roster. Which player would your team add?,1598k95,fsocietybat,6,t3_1598k95,8009642,44,2023-07-25 13:28:01
306,nba,"[Rankin] ""It’s not all on his shoulders, it’s not just him."" Phoenix Suns GM James Jones on Devin Booker. ""It’s more the collective will lead us, but Devin, Kevin and Brad have to play exceptionally well for us to reach our goals."" #Suns",158flye,Kimber80,234,t3_158flye,8009642,86,2023-07-24 16:33:27
307,nba,Peak Iverson v.s. peak Nash?,159motv,Wolver8ne,0,t3_159motv,8009642,94,2023-07-25 22:05:44
308,nba,Nba all star game 2024,1597k98,Killerbunny481,5,t3_1597k98,8009642,3,2023-07-25 12:47:17
309,nba,"Kyle Anderson now a Chinese, set to play for China in the FIBA World Cup",1580q2f,JohnLemonnn69,1742,t3_1580q2f,8009642,395,2023-07-24 05:00:37
310,nba,"[Stein] A look at the full @usabasketball Select team that will be in camp with USAB’s @FIBAWC team from Aug. 3-6 in Las Vegas: Cunningham, Duren, Galloway, J. Green, Grimes, Holmgren, Jenkins, H. Jones, Mika, Murphy, K. Murray, Pritchard, Reid, J. Williams",158m0ck,Brady331,96,t3_158m0ck,8009642,35,2023-07-24 20:26:50
311,nba,USA vs World - who wins 5 v 5?,158y7bv,Character_Reward2734,17,t3_158y7bv,8009642,39,2023-07-25 04:58:41
312,nba,I bet you didn’t expect to see a Larry Sanders highlight video today,158nb23,mahjoonaw,78,t3_158nb23,8009642,21,2023-07-24 21:13:57
