index,subreddit,title,id,author,score,name,subscribers,comments_number,time
313,nba,Former 1st round pick Rondae Hollis-Jefferson is in the process of obtaining Jordanian citizenship ahead of the FIBA World Cup,158lg2t,UTM20,94,t3_158lg2t,8009642,27,2023-07-24 20:06:40
314,nba,"James Harden after 14 NBA seasons: ""I learned it's a business"" | Sports Seriously",158t5jk,Otherwise_Warning922,34,t3_158t5jk,8009642,35,2023-07-25 01:06:53
315,nba,"[Chiang] What’s one of the first things Jaime Jaquez Jr. did after being drafted by the Heat? He sent a text message to Udonis Haslem. ..Jaquez: “I know he’s the OG of the Miami Heat. I felt it was only right that I reach out to him first."" miamiherald.com/sports/nba/mia…",158j52r,Kimber80,110,t3_158j52r,8009642,15,2023-07-24 18:43:55
316,nba,Do you personally know any NBA players currently living a comfortable civillian life?,158wg55,mahjoonaw,20,t3_158wg55,8009642,33,2023-07-25 03:32:31
317,nba,We need to not let NBA players visiting New York in the off-season,15a7h9t,gocelticsgoknicks,0,t3_15a7h9t,8009642,33,2023-07-26 14:33:00
318,nba,"Michael Jordan Hits 13 FGs in a row (1991 Finals, Game 2 vs Lakers)",158hq8x,Affectionate-Ad2081,92,t3_158hq8x,8009642,23,2023-07-24 17:50:59
319,nba,Angry Balkan coaches' timeouts from the EuroLeague (Compilation),158epqz,WhenMachinesCry,123,t3_158epqz,8009642,24,2023-07-24 16:00:46
320,nba,Is Kyle Anderson the second greatest Chinese basketball player of all time?,158p93h,JordanHawkinsMVP,39,t3_158p93h,8009642,48,2023-07-24 22:27:10
321,nba,Creating r/nba's way too early 23-24 power rankings,158wko4,ChickenNugget012345,14,t3_158wko4,8009642,4,2023-07-25 03:38:26
322,nba,"Man, the thread on Ben Wallace winning 4 DPoy awards reminded me of going to game six of the Spurs/Pistons finals",158iz0g,CaptainBuckRussell,75,t3_158iz0g,8009642,14,2023-07-24 18:37:42
323,nba,30 best defenders in league history (in no particular order),1591mxz,Fcusjfnfmfkg,7,t3_1591mxz,8009642,49,2023-07-25 07:59:24
324,nba,LeBron trolls stranger on the New York City Subway,157y1ve,fantasticwarriors,1281,t3_157y1ve,8009642,278,2023-07-24 02:45:59
325,nba,"Dennis Schröder on German Basketball Federation official website: ""I would like to apologize to Maxi Kleber and his family. It was never my intention to put anyone in an awkward situation. All of this was never something personal against Maxi Kleber from my side. I hope he accepts my apologies.""",157z6wx,xboumtje,1052,t3_157z6wx,8009642,131,2023-07-24 03:41:15
326,nba,Jerry West talks about what makes basketball & great players so great,158kou6,TheRealPdGaming,51,t3_158kou6,8009642,6,2023-07-24 19:39:35
327,nba,5'9 Nate Robinson dunks on an unexpectant Shaq,157xvdy,fantasticwarriors,1241,t3_157xvdy,8009642,76,2023-07-24 02:37:17
328,nba,Can we please stop with the posts about rankings (all-time or current) and comparisons of players? It is really getting ridiculously incessant.,158fk4t,rabid89,93,t3_158fk4t,8009642,62,2023-07-24 16:31:28
329,nba,"Joey Crawford calls a foul on Marcus Camby for merely existing, sending Steve Nash to the line for two…",158hwga,woofers02,70,t3_158hwga,8009642,29,2023-07-24 17:57:12
330,nba,"Interesting fact: Despite generally being thought of as having played in relatively separate eras, Kareem actually won his first Finals MVP before Wilt did.",158gi5j,amateurdormjanitor,82,t3_158gi5j,8009642,25,2023-07-24 17:06:10
331,nba,Michael Jordan’s monologue from The Last Dance,157ryrn,durklil,2702,t3_157ryrn,8009642,567,2023-07-23 22:11:43
332,nba,"Which player best represents the ""Minimum Viable Player"" on a roster?",158tsdb,doubleoh72,18,t3_158tsdb,8009642,28,2023-07-25 01:34:14
333,nba,How many games would the top 5 MIP from last season win over an 82-game season?,158ab9q,CarBallAlex,158,t3_158ab9q,8009642,56,2023-07-24 13:11:57
334,nba,Russell Westbrook destroys Thon Maker,157wg8z,valiidiix,1314,t3_157wg8z,8009642,119,2023-07-24 01:30:33
335,nba,A reporter asks Kyrie an interesting question,158xfwn,MettaWorldConflict,9,t3_158xfwn,8009642,19,2023-07-25 04:20:03
336,nba,Westbrook MVP Season,158d7ws,DMV_Wade,87,t3_158d7ws,8009642,42,2023-07-24 15:03:45
337,nba,[Wojnarowski] ESPN Sources: The BOG vote was 29-1 to approve the sale. Knicks owner James Dolan registered the lone vote against.,157rrl4,Kimber80,1981,t3_157rrl4,8009642,341,2023-07-23 22:03:50
338,nba,"[Wojnarowski] ESPN Sources: The NBA’s Board of Governors has approved the sale of the Charlotte Hornets to a group led by Rick Schnall and Gabe Plotkin, clearing the way to end Michael Jordan’s 13-year run as majority owner.",157qnd7,Michael_B_Lopez,2198,t3_157qnd7,8009642,290,2023-07-23 21:19:13
339,nba,"Shaq performs ""Maniac"" on Lip Sync Battle",158otw8,Brady331,20,t3_158otw8,8009642,5,2023-07-24 22:10:41
340,nba,"""The Spurs should’ve been the champions” - Rick Barry said Ray Allen should’ve been called for a travel on his clutch shot for the Miami Heat Rick Barry once expressed frustration about a missed call from officials that prevented the San Antonio Spurs from winning a title.",15830q1,MiamiPower,315,t3_15830q1,8009642,149,2023-07-24 07:06:05
341,nba,The Demarcus Cousins or “Prime Boogie” mythos is one of the most inexplicable things I’ve ever seen,157jnvp,bradleynana,4733,t3_157jnvp,8009642,1402,2023-07-23 16:46:20
342,nba,Chuck Hayes’ elite free throw form fakes out the Utah Jazz,157v4tj,hellohi3,1028,t3_157v4tj,8009642,87,2023-07-24 00:29:04
343,nba,Michael Jordan answers the GOAT debate,158ive2,RyanTannegod,33,t3_158ive2,8009642,54,2023-07-24 18:34:04
344,nba,James Harden calls out ESPN over social media post,158m8io,Sea_Background5670,22,t3_158m8io,8009642,28,2023-07-24 20:34:57
345,nba,Recent NBA championship teams that will only have 1 hall of famer?,158spbw,truthisfictionyt,10,t3_158spbw,8009642,41,2023-07-25 00:47:23
346,nba,Biggest difference between a players highlight reel vs how good they actually were?,1588guk,tandtz,115,t3_1588guk,8009642,238,2023-07-24 11:51:35
347,nba,"[Scotto] The Washington Wizards have waived Quenton Jackson, league sources told @hoopshype .",158n4o3,Kimber80,22,t3_158n4o3,8009642,11,2023-07-24 21:07:34
348,nba,Could Muggsy Bougues Play in Today's NBA?,158or60,donttrustmebro,15,t3_158or60,8009642,41,2023-07-24 22:07:44
349,nba,Steph Curry on his remarkable basketball career and new documentary ‘Underrated’,159rgjv,Keikobad,0,t3_159rgjv,8009642,21,2023-07-26 01:19:18
350,nba,Which mystery player would you rather have,158xhal,maltrab,5,t3_158xhal,8009642,30,2023-07-25 04:21:50
351,nba,How did Ben Wallace win 4 DPOYs while Tim Duncan won 0?,157w0rj,AdulasMoonblade,730,t3_157w0rj,8009642,548,2023-07-24 01:10:28
352,nba,Flashback: Hugo The Hornet Greentext,158svx1,jdugan0323,10,t3_158svx1,8009642,4,2023-07-25 00:55:24
353,nba,[Highlight] Ray Allen TAKES OVER in the 4th quarter of Game 4 vs Kings,158ijpp,MajorSlimes,28,t3_158ijpp,8009642,5,2023-07-24 18:22:35
354,nba,We're about to embark upon the LeBron James of Playa Haters Ball this coming season towards the Warriors.,159rxpr,throwaway_mcghee12,0,t3_159rxpr,8009642,70,2023-07-26 01:40:50
355,nba,Who's the 3rd best PG in the modern era (post 1980)?,158rg4d,waynequit,9,t3_158rg4d,8009642,160,2023-07-24 23:54:53
356,nba,[Shelburne] The sense around the Sixers is the Harden situation probably goes unresolved this summer doesn't seem like there's much movement at all... it feels like it could be a long standoff,158nc07,EarthWarping,16,t3_158nc07,8009642,11,2023-07-24 21:14:54
357,nba,Kobe and D-Wade talk Redeem Team gold with Craig Sager after holding off Spain,158gr0a,Mechaultima,35,t3_158gr0a,8009642,2,2023-07-24 17:15:10
358,nba,"Wolves forward Li Kaier, aka Kyle Anderson, obtained Chinese nationality and will play for China at the FIBA World Cup",1581bm4,Ecowatchib,260,t3_1581bm4,8009642,84,2023-07-24 05:32:41
359,nba,Who would win 5v5 in this 90s/00s Legends battle? And how?,159bk61,_veerist,0,t3_159bk61,8009642,33,2023-07-25 15:23:09
360,nba,Why is Paul Pierce still throwing shade at DWade?,159ox6m,Nodolus,0,t3_159ox6m,8009642,41,2023-07-25 23:31:10
361,nba,What's the argument against the Celtics trading Jaylen Brown,159ewse,Autistic_Puppy,0,t3_159ewse,8009642,117,2023-07-25 17:24:41
362,nba,Steve Nash's amazing 2007 season,158ilcn,achyutthegoat,22,t3_158ilcn,8009642,36,2023-07-24 18:24:15
363,nba,"Allen Iverson receives a technical as he “brought the crowd down”. Larry Brown backs AI, loses it with the ref and also receives a technical (2001).",157k7c4,ToronoRapture,2325,t3_157k7c4,8009642,344,2023-07-23 17:07:58
364,nba,What sets apart Dwight Howard and Deandre Jordan in terms of skill set?,159kga1,Steve305210,0,t3_159kga1,8009642,35,2023-07-25 20:44:18
365,nba,"Start, Bench, Cut/Trade to fit your team currently",15954z6,Curious_Success_377,0,t3_15954z6,8009642,50,2023-07-25 10:58:07
366,nba,"2022-2023: Highest (and lowest) TS% in the ""clutch""",158cjmp,yrogreg,38,t3_158cjmp,8009642,64,2023-07-24 14:39:02
367,nba,Jalen Rose explains to Paul Pierce why Dwyane Wade was a better player than him. 🗣️,157cx9m,Mechaultima,5900,t3_157cx9m,8009642,682,2023-07-23 11:54:41
368,nba,Suns bench clear way like a nuclear bomb is coming at them,157m2hb,Naweezy,1643,t3_157m2hb,8009642,78,2023-07-23 18:21:33
369,nba,What teams would be the best basketball fit for these players for next season?,158p8ab,Otherwise_Form1315,9,t3_158p8ab,8009642,21,2023-07-24 22:26:18
370,nba,1 Teenage Kobe puts up 33 points off the bench while being guarded mostly by MJ (who was 1st team all D that year). MJ scored 36 to lead the Bulls to a 21 point win against the Shaqless Lakers. (Pippen also missed the game),157xleb,glassesref89,343,t3_157xleb,8009642,74,2023-07-24 02:24:14
371,nba,Who are some players with oddly mismatched skills sets?,158gfbz,truthisfictionyt,27,t3_158gfbz,8009642,28,2023-07-24 17:03:20
372,nba,What are some current player comps for the 2008 Celtics,158t2h2,KnicksNBAchamps2021,7,t3_158t2h2,8009642,12,2023-07-25 01:03:05
373,nba,How many wins can the Celtics get next year?,159hyoy,Funny-Transition7869,0,t3_159hyoy,8009642,84,2023-07-25 19:15:11
374,nba,Austin Rivers' Grocery Adventure,158ojbv,Afl4c,8,t3_158ojbv,8009642,2,2023-07-24 21:59:45
375,nba,The best NBA team of all time?,158ld25,Commandersforlife,12,t3_158ld25,8009642,25,2023-07-24 20:03:44
376,nba,Which all time great has the worst/most boring highlight reel?,158kkhz,snowjon01,13,t3_158kkhz,8009642,44,2023-07-24 19:35:03
377,nba,[Brian Sutterer MD] Doctor Reacts to Bronny James Cardiac Arrest - What Happened?,159r0ar,MrBuckBuck,0,t3_159r0ar,8009642,79,2023-07-26 00:59:27
378,nba,/r/NBA Hall of Fame: Class of 2002,158moij,Sweden13,9,t3_158moij,8009642,6,2023-07-24 20:51:22
379,nba,Top 100 Nba players right now,159p6me,Fcusjfnfmfkg,0,t3_159p6me,8009642,142,2023-07-25 23:41:36
380,nba,Damian Lillard / Jaylen Brown Trade?,159om0g,seventeenYUH,0,t3_159om0g,8009642,19,2023-07-25 23:19:05
381,nba,NBA Prediction: Wholesome Award,158xnr4,PuddingQuiet5096,0,t3_158xnr4,8009642,11,2023-07-25 04:30:37
382,nba,Should a culture exist where coaches are demoted instead of fired?,158unle,neurotido,2,t3_158unle,8009642,28,2023-07-25 02:11:55
383,nba,Best Player Podcast in the NBA right now?,158njzp,Just_Food_6002,7,t3_158njzp,8009642,30,2023-07-24 21:22:49
384,nba,Camron give Paul Pierce advice on how to deal with Trolls,158l5tu,Frosty-Ad-5601,10,t3_158l5tu,8009642,2,2023-07-24 19:56:37
385,nba,"Prediction, former lottery picks on their rookie deals on their way out the league",1591i2h,Otherwise_Form1315,3,t3_1591i2h,8009642,5,2023-07-25 07:52:14
386,nba,[Basketball Reference] Most FGA from 30+ feet last season: 117 – Damian Lillard (32.5%) 83 – Trae Young (31.3%) 66 – Jordan Poole (33.3%) 62 – Stephen Curry (22.6%) 54 – LaMelo Ball (38.9%) 46 – Fred VanVleet (15.2%) 44 – Kyle Kuzma (31.8%) 34 – Luka Dončić (14.7%) 32 – Tyrese Haliburton (28.1%),157qbtc,Kimber80,576,t3_157qbtc,8009642,226,2023-07-23 21:06:33
387,nba,Who is better?: 01’ Iverson v.s. 2020’ LeBron?,159kljj,Wolver8ne,0,t3_159kljj,8009642,37,2023-07-25 20:49:29
388,nba,Kyle Anderson receives Chinese Citizenship,158e8ni,benchin32,19,t3_158e8ni,8009642,57,2023-07-24 15:43:00
389,nba,There are only 5 active players who have been considered the undisputed best player on a championship team,158f0mu,jaggedjottings,13,t3_158f0mu,8009642,92,2023-07-24 16:11:35
390,nba,Michael Jordan slashing fade away vs the Knicks. He scored 44 points on this night in preparation for his final NBA Playoff run (18.04.1998).,1582hw9,ToronoRapture,93,t3_1582hw9,8009642,17,2023-07-24 06:37:39
391,nba,"In the final year of the Heatles, Wade averaged 17.8 PPG in the playoffs. Pippen through the entire Bulls second 3-peat averaged 17.6 PPG in the playoffs. How come Wade was labeled as washed but people label the Bulls as too stacked?",159q10k,KDBookerBeal,0,t3_159q10k,8009642,92,2023-07-26 00:16:19
392,nba,If the Euroleague could match NBA salaries do you think top talent would flock there?,158q2p6,Therealomerali,3,t3_158q2p6,8009642,33,2023-07-24 22:59:13
393,nba,"Steph Curry is not, and probably at this point cannot achieve a top 10 all time ranking",159y7e1,Budget-Hold-5176,0,t3_159y7e1,8009642,341,2023-07-26 06:59:57
394,nba,Least Efficient Half-Court Scorers,158jm45,Funny-Transition7869,7,t3_158jm45,8009642,27,2023-07-24 19:01:10
395,nba,"Michael Jordan is not the All-Time GOAT, he's the GOAT of his generation and that's it",15a0pbz,timetenfifty,0,t3_15a0pbz,8009642,102,2023-07-26 09:23:15
396,nba,Nick Van Exel goes 2 for 2 on Jalen Rose and Rose throws in the towel twice.,1589l9k,bobbydigital_ftw,25,t3_1589l9k,8009642,4,2023-07-24 12:41:53
397,nba,"Shaq, LeBron, and Dwight show off their dance moves during the 2007 All-Star Weekend",157t0ac,fantasticwarriors,302,t3_157t0ac,8009642,49,2023-07-23 22:55:15
398,nba,Joshua Primo: worth a shot at redemption or out of the league for good?,159bth8,donalben,0,t3_159bth8,8009642,57,2023-07-25 15:32:40
399,nba,"[Recommendation] If you have any interest in hearing about the life of a fundamentally decent person, listen to Dan Le Batard's South Beach Sessions with NBA commentator Mike Breen",158qwkz,Number333,3,t3_158qwkz,8009642,6,2023-07-24 23:32:26
400,nba,Is Anthony Edwards overrated or underrated?,159eqgh,LeBurnerAccount1,0,t3_159eqgh,8009642,77,2023-07-25 17:18:28
401,nba,"FIBA are currently using a glass floor with LED’s, making a dynamic court that can react to plays.",157fm5v,ArissP,1237,t3_157fm5v,8009644,344,2023-07-23 14:01:40
402,nba,"Draymond Green & Jordan Poole vibing to ""Whoop That Trick"" down 46 to Grizzlies",157xmnh,Party-Ad-7077,126,t3_157xmnh,8009644,20,2023-07-24 02:25:54
403,nba,Fictional Basketball League,1594lug,Affectionate_Road944,0,t3_1594lug,8009644,16,2023-07-25 10:31:27
404,nba,"Quick, name two unrelated players who played similarly",158sa3y,JordanHawkinsMVP,4,t3_158sa3y,8009644,40,2023-07-25 00:29:23
405,nba,[HoopsHype] Jaylen Nowell on Mavericks' radar,158ai2y,EarthWarping,15,t3_158ai2y,8009644,10,2023-07-24 13:19:56
406,nba,[Highlight] Ray Allen splashes 4 straight 3s during Game 6 of the 2001 ECF. He scored 19 straight points for the Bucks and 41 total to push the series to Game 7,157jpv1,MajorSlimes,644,t3_157jpv1,8009644,107,2023-07-23 16:48:42
407,nba,What was most entertaining NBA game you got to watch inside the arena?,158rog8,TheEverbless,1,t3_158rog8,8009644,19,2023-07-25 00:04:17
408,nba,"'Wait, Wait...Don't Tell Me': Live in Portland with Damian Lillard (NPR variety talk show)",158c8la,OregonTripleBeam,13,t3_158c8la,8009644,8,2023-07-24 14:27:24
409,nba,Which year did it become debatable (or even clear) that the top end talent of the rest of the world (non-US born players) either matched or exceeded American born talent? Also additional questions regarding this.,158a64w,TFA_936_662,16,t3_158a64w,8009644,32,2023-07-24 13:06:02
410,nba,Nikola Jokic to reportedly skip FIBA World Cup,157dqpf,horseshoeoverlook,1279,t3_157dqpf,8009644,494,2023-07-23 12:34:58
411,nba,People staunchly hold joining Golden State against Durant. Do you guys hold joining Miami against LeBron?,159ndlb,CulturalRoll,0,t3_159ndlb,8009644,214,2023-07-25 22:32:00
412,nba,"Open shot, the fate of the universe on the line, the Martians have the death beam pointed at earth, and it's 2023, who do you want taking the shot?",158w1u4,ajteitel,0,t3_158w1u4,8009644,72,2023-07-25 03:14:11
413,nba,"Joel Embiid parties with several teammates at his wedding, James Harden nowhere to be found",157f1hs,FultzShoulder,1030,t3_157f1hs,8009644,170,2023-07-23 13:35:35
414,nba,Which Non-All Star or Superstar in the past would thrive in the current NBA with their playstyle?,1585l0y,Guevarra25,26,t3_1585l0y,8009644,77,2023-07-24 09:28:12
415,nba,"[Rankin] “Don’t second-guess it, don’t overthink it. Trust your instincts, trust your team and then go out there, find the best options for us and then make those options work."" Phoenix Suns GM James Jones on Mat Ishbia's main input in constructing roster for the 2023-24 season. #Suns",1588478,Kimber80,17,t3_1588478,8009644,11,2023-07-24 11:35:13
416,nba,Both Dame and Giannis have DISRESPECT put on their names!,1582466,PlexBabyPlexBaby1234,49,t3_1582466,8009644,24,2023-07-24 06:16:31
417,nba,New CBA Summary?,158qc87,ReputationOld901,3,t3_158qc87,8009644,5,2023-07-24 23:09:45
418,nba,Shaq’s best rebounding season came in his rookie year.,157n51k,SqueakyBeats00,324,t3_157n51k,8009644,83,2023-07-23 19:03:18
419,nba,"Grant Williams: We're up 2-1 in the Finals. Game 4, we're leading the entire way, thinking we might go back to GS and win this. But them Charlotte, NC boys...that man was different. I grew up watching Warriors clean the Cavs. [Curry] was absurd to watch then, but playing vs. him...he's different",157ps2j,Barbell_Flyes,239,t3_157ps2j,8009644,94,2023-07-23 20:45:04
420,nba,LeBron has played more NBA seasons after his last MVP than before.,15797mk,ziggyzigg95,2095,t3_15797mk,8009644,609,2023-07-23 08:29:33
421,nba,Do you agree with the general sentiment that the league currently is the most talented its ever been?,157wcj3,guestspeaker9,79,t3_157wcj3,8009644,206,2023-07-24 01:25:52
422,nba,Hawks star Trae Young got married on saturday,157czhp,randomnizer456,964,t3_157czhp,8009644,99,2023-07-23 11:57:58
423,nba,[Highlight] NBA Champions Denver Nuggets go on a wild run with 3 consecutive dunks,157eo38,doggoesmeow,751,t3_157eo38,8009644,51,2023-07-23 13:18:18
424,nba,Stephon Marbury ball fake on Vlade Divac (2001 ASG),157n3oi,WhenMachinesCry,253,t3_157n3oi,8009644,39,2023-07-23 19:01:53
425,nba,Sam Dekker with Early Contender for Blooper of the Year,1590aho,Sea_Credit_6275,0,t3_1590aho,8009644,8,2023-07-25 06:48:39
426,nba,Who would you rather have? Haliburton or Anthony Edwards.,159eiie,psychedelic93,0,t3_159eiie,8009644,143,2023-07-25 17:10:35
427,nba,"Daryl Morey on James Harden’s contract in 2022: “It’s a mutual love fest, so we feel like we’ll work it out.”",157npru,atlfirsttimer,195,t3_157npru,8009644,106,2023-07-23 19:25:46
428,nba,Cam and Mase have Paul Pierce talk about Celtics and Wemby,158d2b6,Frosty-Ad-5601,5,t3_158d2b6,8009644,2,2023-07-24 14:58:23
429,nba,"Cp3 turns it over twice in the final 17 seconds [LAC @ OKC, Game 5]",157o1vn,GenericDarkFriend,163,t3_157o1vn,8009644,46,2023-07-23 19:38:41
430,nba,Melo goes for the 'Spine Tingler' dunk after the whistle (2016),157g0oa,WhenMachinesCry,416,t3_157g0oa,8009644,36,2023-07-23 14:18:47
431,nba,[Highlight] Amar'e Stoudemire's Top 10 Plays of His Career,157qp06,FireAndBud11,114,t3_157qp06,8009644,33,2023-07-23 21:21:01
432,nba,What would prime Shaq's averages be in today's NBA?,158jmer,DonT012,3,t3_158jmer,8009644,63,2023-07-24 19:01:25
433,nba,"Eight of Kevin Garnett's ""Top-5"" Lists",157iise,rsoxguy12,286,t3_157iise,8009644,71,2023-07-23 16:00:55
434,nba,Where do the last remaining FAs end up?,1585646,scrawlx101,12,t3_1585646,8009644,10,2023-07-24 09:05:14
435,nba,Who would you rather have going into next season Chris Paul or Russel Westbrook?,15802zg,Haveyoureaditb4,24,t3_15802zg,8009644,89,2023-07-24 04:26:25
436,nba,Which player dominated the modern NBA the most?,158ozja,FewGLoco,0,t3_158ozja,8009644,20,2023-07-24 22:16:47
437,nba,Why Did You Start Supporting Your Team?,157ruav,-Hiisi-,87,t3_157ruav,8009644,346,2023-07-23 22:06:47
438,nba,"Assuming players don't take the In-Season Tournament seriously, what do you think should the league do to improve it?",1591elw,whocares139,0,t3_1591elw,8009644,40,2023-07-25 07:47:07
439,nba,James Harden and the weirdest career of any NBA superstar ever,157vska,EarthWarping,43,t3_157vska,8009644,42,2023-07-24 00:59:51
440,nba,Could any GM with a time machine turn their team into a contender within 5 years or less?,1585618,iamwearingashirt,8,t3_1585618,8009644,19,2023-07-24 09:05:07
441,nba,Which career record do you think is harder to break? Stocktons steals record or Hakeems blocks record.,157doje,AdorableBackground83,357,t3_157doje,8009644,166,2023-07-23 12:32:05
442,nba,[JJ Redick] We Had To Ask Grant Williams About IMMA MAKE 'EM BOTH... 💀💀💀,157uxvc,rabid89,39,t3_157uxvc,8009644,17,2023-07-24 00:20:11
443,nba,"In the year of 2030, Jimmy Butler will be turning 41 years old. Dame 40. Is the argument of ""Heat 2028, 2030 picks are garbage"" a bit overblown?",157eung,realudonishaslem,275,t3_157eung,8009644,241,2023-07-23 13:26:43
444,nba,How does Giannis compare to prime LeBron defensively?,157meno,BigDaddyJuno,100,t3_157meno,8009644,166,2023-07-23 18:34:52
445,nba,LeBron James gets sent FLYING across the court by Nazr Mohammed! 2013 NBA Playoffs: Heat/Bulls Game 3,158plgq,CulturalRoll,0,t3_158plgq,8009644,7,2023-07-24 22:40:20
446,nba,Every NBA team if they spelled their name like Dwyane Wade,156wmgj,Smelldicks,4039,t3_156wmgj,8009644,384,2023-07-22 22:00:28
447,nba,Predicting Which NBA Players Will Get Most Flopping Techs This Season,157tnq8,csummerss,32,t3_157tnq8,8009644,58,2023-07-23 23:23:08
448,nba,Players with good looking jumpers that dont work?,1582hd6,Funny-Transition7869,10,t3_1582hd6,8009644,38,2023-07-24 06:36:48
449,nba,Nick Van Exel PWNS Jalen Rose (hitting him twice on the sideline),157xaqw,MrBuckBuck,23,t3_157xaqw,8009644,11,2023-07-24 02:10:24
450,nba,Do you think MJ would comeback for that Saudi money?,158zem3,metr0nome,0,t3_158zem3,8009644,27,2023-07-25 06:01:10
451,nba,Should OKC trade for Lauri Markkanen?,158nh6w,ahrumah,0,t3_158nh6w,8009644,95,2023-07-24 21:20:01
452,nba,So what's the big splashy move the Hornets make now that they have new owners?,157tm2z,Otherwise_Form1315,28,t3_157tm2z,8009644,44,2023-07-23 23:21:09
453,nba,What's been your favorite move of the offseason so far?,157v2af,KuraxKira,21,t3_157v2af,8009644,86,2023-07-24 00:25:44
454,nba,"Joel Embiid, after the 2019 game 7 loss to the Toronto raptors being comforted by his now wife Anne de Paula.",1577ymq,KingWhoBoreTheSword,492,t3_1577ymq,8009644,202,2023-07-23 07:17:40
455,nba,"Top 10 greatest father-son duos to ever play in NBA history: (1) Dell/Steph, (2) Arvydas/Domantas, (3) Mychal/Klay, (4) Payton/ Payton Jr, (5) Rick/Jalen Brunson, (6) Hardaway/Hardaway Jr (7) Kenyon/Kenyon Jr, (8) Nance/Nance Jr., (9) Trent/Trent Jr., (10) Manute / Bol.",157pfb8,rabid89,46,t3_157pfb8,8009644,82,2023-07-23 20:31:18
456,nba,Would an extremely obese(like sumo wrestler sized) basketball player be able to be successful?,158xkw8,ColdCocking,0,t3_158xkw8,8009644,39,2023-07-25 04:26:46
457,nba,"Kobe and Shaq reunite at the 2009 NBA All-Star Game. According to Shaq, ""We were the Greatest 1-2 Punch. Ever.""",157dtsj,LALakers4Lyf,159,t3_157dtsj,8009644,80,2023-07-23 12:39:05
458,nba,Which big 3 u taking?,158qwl4,nakotamcc,0,t3_158qwl4,8009644,41,2023-07-24 23:32:26
459,nba,"[Rankin] In Part 2 of @azcentral Q&A with Phoenix Suns GM James Jones, he said Deandre Ayton, who turns 25 years old today, is ""one of the top 6 centers in the NBA."" Agree or disagree?",157f8np,Kimber80,112,t3_157f8np,8009644,84,2023-07-23 13:45:13
460,nba,"We live in an alternate Universe where Draymond Green plays with an average team instead of the two greatest shooters of his generation, is he an All-Star player?",156xt8e,Strange_Control8788,1746,t3_156xt8e,8009644,1035,2023-07-22 22:50:11
461,nba,What is your favorite NBA city? (Other than your own),157seb4,-Hiisi-,22,t3_157seb4,8009644,30,2023-07-23 22:29:13
462,nba,Best Coaching Performances every year since 2014,157t7l2,PaulTiaggo,18,t3_157t7l2,8009644,19,2023-07-23 23:03:52
463,nba,76ers Star Joel Embiid Got Married On Saturday,156weti,Currymvp2,1720,t3_156weti,8009644,362,2023-07-22 21:51:29
464,nba,What is the greatest playoff series by a team that didn’t reach the Conference Finals?,157kan5,Outrageous_Hamster_6,51,t3_157kan5,8009644,73,2023-07-23 17:11:44
465,nba,"This clip from King's Reign by The Athletic NBA Show podcast is an all-timer. After a couple minutes of discussing the controversy of Draymond's game 5 suspension, Channing Frye is asked if LeBron baited Draymond into the foul",158go44,weems13,0,t3_158go44,8009644,8,2023-07-24 17:12:14
466,nba,[ESPN] Harden needs to look himself in the mirror. You are enroute to being on your 4th team in the last 2 years,158jpy6,Barbell_Flyes,0,t3_158jpy6,8009644,40,2023-07-24 19:04:50
467,nba,Is Nba Con a thing?,158mb2t,MartinIsFarting,0,t3_158mb2t,8009644,4,2023-07-24 20:37:32
468,nba,"Don't make fun of me for asking this, but why are Amen and Ausar Thompson's facial structures so distinct?",158rzd3,DetroitWhat1992,0,t3_158rzd3,8009644,18,2023-07-25 00:16:48
469,nba,kawhi in 2016 playoffs,157yl5x,stefanfan101,4,t3_157yl5x,8009644,40,2023-07-24 03:11:45
470,nba,NBA Expansion: Which Cities Deserve a Team?,1589wdz,-Hiisi-,0,t3_1589wdz,8009644,66,2023-07-24 12:55:17
471,nba,LeBron showcasing his defensive versatility against the Spurs,156vjun,Plastic-Dot-9278,1480,t3_156vjun,8009644,356,2023-07-22 21:16:13
